地域,章,名称,国名,登録基準,場所,特殊遺産,時代・王朝,人種・民族,政治家,芸術家,生物,植物,構成資産,構成資産の詳細,美術品,建築・絵画の様式,文化,宗教,バイオーム,特徴
基礎知識,世界遺産条約,世界遺産とは,世界の文化遺産及び自然遺産の保護に関する条約,,,,,,,,,,,,,,,,,"世界遺産リストに記載されている「顕著な普遍的価値（OUV）」を有する自然や生態系保存地域、記念建造物、遺跡である
世界遺産条約では「文化遺産」と「自然遺産」と「複合遺産」が定められているほか、「危機遺産リスト」もつくられている
2014年にボツワナの「オカバンゴ・デルタ」が1000件目の世界遺産になる"
基礎知識,世界遺産条約,世界遺産条約の採択,,,,,,,,,,,,,,,,,,"萩原徹日本政府代表が議長を務めた1972年の第17回UNESCO総会にて11月16日に採択された国際条約
世界遺産基金への支払いを任意にすべきか、義務とするべきかで議論が紛糾した
1973年にアメリカが最初に批准し12月17日に条約が発効した一方で、日本は参加が遅れ1992年6月30日に批准した"
基礎知識,世界遺産条約,世界遺産条約の概要,,,,,,,,,,,,,,,,,,"従来とは異なる新たな破壊の脅威に直面しているだけでなく、各国の保護体制の状況を踏まえ国際的に保護することが採択の背景
文化遺産と自然遺産を1つの条約で保護しようとしている点が非常に重要"
基礎知識,世界遺産条約,世界遺産条約第2章,,,,,,,,,,,,,,,,,,"一義的な義務と責任は遺産を保有する各締約国にあるため、自国の能力や国際的な協力を得て最善を尽くす必要がある
文化遺産と自然遺産に対して社会生活における役割を与えること
立法、行政、財政、技術、学術上で適切な措置をとること
全締約国が遺産の保護に協力することが国際社会全体の義務である"
基礎知識,世界遺産条約,世界遺産条約第3章,,,,,,,,,,,,,,,,,,"世界遺産委員会の設置とそこに諮問機関の代表1人、他の政府間機関やNGOの代表も顧問の資格で出席できる
世界遺産リストに記載するには遺産を保有する国の同意が必要である
2つ以上の国が主権や管轄権を主張する領域にある遺産を登録することが、その紛争におけるいかなる国の権利にも影響を及ぼすものでない
危機にさらされている世界遺産リスト（危機遺産リスト）を作成し公表する
国際的援助の要請があったとき、措置と援助内容等を話し合い世界遺産基金での使い道を決定する
世界遺産基金での使い道を決定する際、委員会に出席して投票する委員国の3分の2の多数による決議で行われる"
基礎知識,世界遺産条約,世界遺産条約第4章,,,,,,,,,,,,,,,,,,"世界遺産基金の設立が定められており、これは世界遺産委員会が決定する目的にのみ使用することができる
世界遺産基金に対する拠出にはいかなる政治的な条件も付けることができない
世界遺産基金への分担拠出金または任意の拠出金の支払いが延滞している締約国は、世界遺産委員会の委員国に選出される資格がない"
基礎知識,世界遺産条約,世界遺産条約第6章,,,,,,,,,,,,,,,,,,締約国が教育や広報事業計画などあらゆる適当な手段を用いて、自国民が文化遺産や自然遺産を評価し、尊重することを強化する
基礎知識,世界遺産条約,世界遺産委員会,,,,,,,,,,,,,,,,,,"世界遺産委員会の議長と書記1名、副議長5名の7名（7カ国）で構成される任期1年のビューロー会議を設置し、会期中に必要なだけ会議を開催する
委員国の任期は6年であるが、公平かつ均等な機会が与えられるように、自発的に4年で任期を終え、連続して再選することの自粛が望ましいとされる
委員国が様々な地域や文化を代表するように、委員国の選出には地域間の公平性も考慮されている
世界遺産リストへの可否について、「登録」「情報照会」「登録延期」「不登録」の4段階がある
世界遺産委員会は「世界遺産条約履行のための戦略的目標（5つのＣ）」を策定しそれに従って審議が行われる
世界遺産リスト記載数の上限は定められていないが、1締約国からの推薦上限を1回の世界遺産委員会につき1件としている
「情報照会」や「登録延期」の決議が出された遺産が再推薦された場合は2件まで推薦することができる
1回の世界遺産委員会での審議数は35件まで
推薦数が35件を超えたときの優先の特徴は、世界遺産保有が少ない国、プレリミナリー・アセスメントを使用した遺産、自然遺産といった点があげられる"
基礎知識,世界遺産条約,世界遺産委員会の役割,,,,,,,,,,,,,,,,,,"暫定リストと締約国から提出された推薦書に基づき、世界遺産リストへの記載の可否を決定する
世界遺産リストに記載された遺産の保全状況を、リアクティブ・モニタリングと定期報告を通じて調査する
世界遺産条約履行のための作業指針の改定と採択を行う"
基礎知識,世界遺産条約,世界遺産の登録,,,,,,,,,,,,,,,,,,"「登録」は世界遺産リストへの記載を認める決議
「情報照会」は次回の世界遺産委員会に推薦書を再提出し、審議を受けることができる
「不登録」は例外邸な場合を除き再推薦が認められていない"
基礎知識,世界遺産条約,5つのC,,,,,,,,,,,,,,,,,,"Creddibility
Conservation
Capacity-building
Communication
Communities"
基礎知識,世界遺産条約,世界遺産条約履行のための作業指針,,,,,,,,,,,,,,,,,,"1977年の第1回世界遺産委員会で採択された
手続きとして世界遺産リストと危機遺産リストの記載やその遺産の保護と保全、世界遺産危機に基づく国際的援助の付与、世界遺産条約を支える国家的・国際的な動員がある
「顕著な普遍的価値」の考え方といった概念的な指針だけでなく、実務的な指針、世界遺産エンブレム使用の規定まで示されている
作業指針の主な対象は世界遺産条約締約国、世界遺産委員会、UNESCOの世界遺産センター、世界遺産委員会の諮問機関、遺産の保護にかかわる関係者である"
基礎知識,世界遺産条約,手続規則,,,,,,,,,,,,,,,,,,"世界遺産委員会に関係する手続規則が細かく定められている
規則の改訂は世界遺産委員会での投票で3分の2の賛成で可決される"
基礎知識,世界遺産条約,暫定リスト,潜在的なOUVがあり世界遺産に推薦する可能性がある締約国が判断した各締約国内の遺産のリスト,,,,,,,,,,,,,,,,,"暫定リストに記載されプレリミナリー・アセスメントを実施した遺産のみ世界遺産に推薦することができる
遺産の管理者や地方自治体、地域社会、先住民族、NGOなどの権利・利害関係者と協議しながら作成することが推奨されている"
基礎知識,世界遺産条約,世界遺産条約締約国会議,世界遺産条約を採択した全締約国による会議,,,,,,,,,,,,,,,,,世界遺産基金への分担金拠出の分担比率の決定や世界遺産委員会委員国の選定を行う
基礎知識,世界遺産条約,世界遺産委員会事務局（世界遺産センター）,世界遺産委員会を補佐する世界遺産委員会事務局の役割を担うために1992年に設立し、パリのUNESCO内部に常設されている,,,,,,,,,,,,,,,,,"世界遺産リスト記載のための推薦書の受理、事務局での登録、書類内容が完全であるかの確認を行う
グローバル・ストラテジーの一環としての研究やその他の活動の調整
リアクティヴ・モニタリングの調整と実施"
基礎知識,世界遺産条約,世界遺産基金,UNESCOの財政規則に基づき1976年に設立,,,,,,,,,,,,,,,,,"拠出金の支払いが延滞している締約国は、世界遺産委員会の委員国に選出される資格がないのと同時に、緊急援助以外の国際的援助も受けることができない
現在、世界遺産基金は資金が大きく不足しており、緊急援助よりも準備援助に優先的に予算が振り分けられるなど課題が多い"
基礎知識,世界遺産条約,国際的援助,世界遺産基金を第一の資金源とする国際的な支援の仕組み,,,,,,,,,,,,,,,,,"緊急援助、保全・管理援助、準備援助という3つの分野がある
ジェンダー平等や地域コミュニティと先住民の関与についての活動と関係しているかどうかなども考慮される"
基礎知識,UNESCOの世界遺産委員会の諮問機関,UNESCO,フランスのパリに本部を置く国際連合の専門機関,,,,,,,,,,,,,,,,,"1945年に「国際連合教育科学文化機関憲章（UNESCO憲章）」が採択された
教育や科学、文化を通じて諸国民の連帯を促進し、基本的自由が尊重される世界の平和と福祉に貢献することを目的としている
諸国間、諸民族の交流を進め、文化の多様性を理解・尊重しあることが、世界の平和につながると説いた
松浦晃一郎氏は日本人かつアジアン人として初UNESCO事務局長を務め、無形文化遺産条約の成立などに尽力した"
基礎知識,UNESCOの世界遺産委員会の諮問機関,世界遺産委員会の諮問機関,"ICCROM
ICOMOS
IUCN",,,,,,,,,,,,,,,,,"それぞれの専門分野について世界遺産条約履行に関する助言を行う
諮問機関の負担の増加が課題となっている"
基礎知識,UNESCOの世界遺産委員会の諮問機関,ICCROM,文化財の保存及び修復の研究のための国際センター,,,,,,,,,,,,,,,,,"イタリアのローマに置く国際的な政府間機関で1959年に改設された
不動産や動産の文化遺産の保全強化を目的とした"
基礎知識,UNESCOの世界遺産委員会の諮問機関,ICOMOS,国際記念物遺跡会議,,,,,,,,,,,,,,,,,"フランスのパリに置く非政府機関で、ヴェネツィア憲章の原則をもとに1965年に設立された
2017年から2020年まで会長を務めた河野俊之氏は名誉会長を務め、大窪健之氏は2021年より理事を務めている"
基礎知識,UNESCOの世界遺産委員会の諮問機関,IUCN,国際自然保護連合,,,,,,,,,,,,,,,,,"スイスのグランにおく世界的組織で、1948年に設立された
文化的景観の価値で推薦された文化遺産の自然の価値や保全管理などについてICOMOSへ助言を行う"
基礎知識,世界遺産の定義,顕著な普遍的価値,,,,,,,,,,,,,,,,,,"人類全体にとって現在だけでなく将来世代にも共通した重要性を持つ
真正性や完全性、法的な保護もバッファー・ゾーンの設定を含む保全管理、登録基準との適合などが含まれる
世界遺産リストに遺産を記載する際には顕著な普遍的価値の言明（SOUV）を採択する"
基礎知識,世界遺産の定義,文化遺産,,,,,,,,,,,,,,,,,,人類の歴史が生み出した記念物や建造物群、遺跡、文化的景観
基礎知識,世界遺産の定義,自然遺産,,,,,,,,,,,,,,,,,,地球の生成や動植物の進化を示す
基礎知識,世界遺産の定義,複合遺産,,,,,,,,,,,,,,,,,,文化遺産と自然遺産、両方の価値を兼ね備えている
基礎知識,世界遺産の定義,危機遺産,危機にさらされている世界遺産リスト,,,,,,,,,,,,,,,,,"重大かつ明確な危険にさらされており、その脅威が人間の関与により改善可能である
世界遺産条約に基づく援助がその遺産に対し要請されている場合、委員会はその遺産を危機遺産リストに記載することができる
1979年にモンテネグロの「コトルの文化歴史地域と自然」がはじめて危機遺産リストに記載された
危機遺産リストへの登録基準には「明白な危機」と「潜在的な危機」が文化遺産と自然遺産でそれぞれ定められている
危機遺産リストへの記載を検討する際、未知の原因又は予期できない原因についても考慮すべきである
危機にさらされている世界遺産リストから当該遺産を削除するための望ましい保全状況と改善措置計画を策定し採択する
リアクティヴ・モニタリングを行い遺産を脅かす危機の性質や範囲を評価し、実施すべき措置を提案する
締約国と協議が行われていない場合は、世界遺産委員会は世界遺産リストからの抹消を決定することはできない
「バグラティ大聖堂とゲラティ修道院」においてバグラティ大聖堂の真正性が損なわれたとしてゲラティ修道院単体での世界遺産登録となった"
基礎知識,世界遺産の定義,世界遺産リストにおける重大かつ特別な危機の例,,,,,,,,,,,,,,,,,,"急速に進む破損
大規模な公共工事、民間事業、急激な都市開発事業、観光開発事業に起因する消失の危機
原因が不明である大規模な変化
理由のいかんに依らない放棄
武力紛争の勃発、またはその恐れ
大規模な災害、異変、大火、地震や地滑り"
基礎知識,世界遺産の定義,緊急的登録推薦,,,,,,,,,,,,,,,,,,顕著な普遍的価値が明らかで危機に直面している遺産を、通常の登録手順を取らずに緊急的に登録すること
基礎知識,世界遺産の定義,世界遺産リストから抹消された遺産,,,,,,,,,,,,,,,,,,"アラビアオリックスの保護地区
ドレスデン・エルベ渓谷
リヴァプール海商都市"
基礎知識,世界遺産の定義,負の遺産,,,,,,,,,,,,,,,,,,"世界遺産条約では定義されていない
2023年では「記憶の場（サイト・オブ・メモリー）」の登録も始まった"
基礎知識,顕著な普遍的価値の評価基準,登録基準,,,,,,,,,,,,,,,,,,10項目からなる登録基準があり、この中から1つ以上が認められなければならない
基礎知識,顕著な普遍的価値の評価基準,ⅰ,,,,,,,,,,,,,,,,,,人類の創造的資質や人間の才能を示す遺産
基礎知識,顕著な普遍的価値の評価基準,ⅱ,,,,,,,,,,,,,,,,,,文化の価値観の相互交流を示す遺産
基礎知識,顕著な普遍的価値の評価基準,ⅲ,,,,,,,,,,,,,,,,,,文化的伝統や文明の存在に関する証拠を示す遺産で人類の化石遺跡なども含まれる
基礎知識,顕著な普遍的価値の評価基準,ⅳ,,,,,,,,,,,,,,,,,,建築様式や建築技術、科学技術の発展段階を示す遺産
基礎知識,顕著な普遍的価値の評価基準,ⅴ,,,,,,,,,,,,,,,,,,独自の伝統的集落や、人類と環境の交流を示す遺産で、農業景観や文化的景観が特徴の遺産
基礎知識,顕著な普遍的価値の評価基準,ⅵ,,,,,,,,,,,,,,,,,,人類の歴史上の出来事や伝統、宗教、芸術などと強く結びつく遺産や無形の要素が重要になっている
基礎知識,顕著な普遍的価値の評価基準,ⅶ,,,,,,,,,,,,,,,,,,自然美や景観美、独特な自然現象を示す遺産
基礎知識,顕著な普遍的価値の評価基準,ⅷ,,,,,,,,,,,,,,,,,,地球の歴史の主要段階を示す遺産で、恐竜や古代生物の化石遺跡も含まれる
基礎知識,顕著な普遍的価値の評価基準,ⅸ,,,,,,,,,,,,,,,,,,動植物の進化や発展の過程、独自の生態系を示す遺産
基礎知識,顕著な普遍的価値の評価基準,ⅹ,,,,,,,,,,,,,,,,,,絶滅危惧種の生息域でもある、生物多様性を示す遺産
基礎知識,世界遺産に関係する概念,真正性,,,,,,,,,,,,,,,,,,"それぞれの文化的背景の独自性や伝統を継承している
個別の構成資産の真正性だけでなく、資産全体としての真正性が評価される
1994年に「真正性に関する奈良会議」で「奈良文書」が採択され、遺産がある場所の地理や気候、環境などの自然条件と、文化・歴史的背景などの文化的文脈との関係の中で評価すべきとされた
文化ごとの真正性が保証される限りは遺産の解体修復や再建なども可能"
基礎知識,世界遺産に関係する概念,真正性の属性,,,,,,,,,,,,,,,,,,"形状と意匠
材料と材質
用途と機能
伝統と技能、管理体制
所在地と周辺環境
言語と、無形遺産のその他の要素
精神性と歓声
その他の内部・外部の要素"
基礎知識,世界遺産に関係する概念,完全性,,,,,,,,,,,,,,,,,,"世界遺産の「顕著な普遍的価値」を構成するために必要な要素がすべて含まれる
長期的な保護のための法律などの体制も整えられていることが求められる
自然遺産は生物学的な家庭や地形上の特徴が比較的無傷であることが求められる
自然遺産では、登録基準ごとに完全性の条件が定義されている"
基礎知識,世界遺産に関係する概念,文化的景観,,,,,,,,,,,,,,,,,,"自然と人間の共同作品に相当し、人間社会が自然環境による制約の中で、社会的、経済的、文化的に影響を受けながら進化してきたことを示す遺産に認められる
そこで暮らす人々が持続可能な土地利用のために進化させた独自の技術や、人々と自然との精神的なつながりを反映していることが多い
1993年「トンガリロ国立公園」において、世界ではじめて文化的景観の価値が認められた
長い直線状のエリアも文化的景観の対象となる"
基礎知識,世界遺産に関係する概念,カテゴリー,,,,,,,,,,,,,,,,,,"意匠された景観:人間によってデザインされ想像された景観
有機的に進化する景観:社会や経済、政治、宗教などに対応して生まれ、自然環境に対応しその関連性の中で形成された景観
関連する景観:自然的な要素が、宗教的、芸術的、文学的な要素と強く関連する景観"
基礎知識,世界遺産に関係する概念,グローバル・ストラテジー,世界遺産リストにおける不均衡の是正及び代表性、信用性の確保のためのグローバル・ストラテジー,,,,,,,,,,,,,,,,,"宮殿や要塞、教会や修道院など「記念碑」的な遺産に偏っていた
遺産の適切な評価を行うための暫定リストの作成と、不備のない推薦書を作成するための能力構築が欠かせない"
基礎知識,世界遺産に関係する概念,シリアル・サイト,,,,,,,,,,,,,,,,,,必ずしも個々の構成資産が「顕著な普遍的価値」を持っている必要はなく、全体として「顕著な普遍的価値」を持っていればよい
基礎知識,世界遺産に関係する概念,トランスバウンダリー・サイト,,,,,,,,,,,,,,,,,,できる限り関係締約国が共同で登録推薦書を作成し、共同管理委員会などの機関を設置して遺産全体の管理を監督することが強く推奨されている
基礎知識,世界遺産に関係する概念,MAB計画,人間と生物圏計画,,,,,,,,,,,,,,,,,"自然保護と地域社会が両立した持続可能な発展を目指している
「核心地域」と「バッファー・ゾーン」の概念を援用している
バッファー・ゾーンの外側である「広域な周辺環境（wider setting）」での森林伐採や都市開発などが大きな課題となっている"
基礎知識,世界遺産に関係する概念,MAB計画の主な活動,,,,,,,,,,,,,,,,,,"生物圏の変化を特定し評価
生態系と社会・経済的なプロセスとの相互関係の研究
人間の基本的な福祉と住みやすい環境の確保
知識の交換と伝達を促進"
基礎知識,世界遺産に関係する概念,バッファー・ゾーン,,,,,,,,,,,,,,,,,,"この設定が自然遺産と文化遺産双方において厳格に求められるようになった
変更したい場合は「軽微な変更」の手続きで委員会から承認を得る必要がある"
基礎知識,世界遺産に関係する概念,記憶の場,,,,,,,,,,,,,,,,,,"国家とその国民（少なくとも国民の一部）もしくはコミュニティが、記憶に残したいと考える出来事が起こった場所
2023年の委員会で「近年の紛争（リーセント・コンフリクツ）」における議論の前提とした「記憶の場」の、関する世界遺産が3件登録された
推薦に際しては関係締約国の対話を通じた合意が重要である
平和と対話の文化を促進するために教育的な役割を果たさなければならない
記憶の歪曲を避けるために事実の正確さを証明する必要がある"
基礎知識,世界遺産に関係する概念,5つのC,世界伊団条約履行のために戦略的目標,,,,,,,,,,,,,,,,,Credibility（信頼性）/Conservation（保全）/Capacity-builiding（能力構築）/Communication（情報伝達）/Communitiis（共同体）
基礎知識,世界遺産に関係する概念,定期報告,,,,,,,,,,,,,,,,,,"6年ごとに定期報告を行う
アラブ→アフリカ→アジア・太平洋→ラテンアメリカ・カリブ海地域→ヨーロッパ・北米の順番で毎年地域を変えている"
基礎知識,世界遺産に関係する概念,リアクティヴ・モニタリング,,,,,,,,,,,,,,,,,,"予期せぬ状況に陥った場合や「顕著な普遍的価値」や保全状況に影響を与える場合は、その都度締約国は個別の報告書と影響調査を提出する
危機遺産リストに記載されている遺産や、記載される可能性がある遺産に実施される他、世界遺産リストから抹消される可能性のある遺産も対象"
基礎知識,世界遺産に関係する概念,緊急的登録推薦,「顕著な普遍的価値」があることに疑いがないと考えられる遺産だが、災害や人的行為による被害や重大で具体的な危機に直面しているときに通常の推薦プロセスえ経ずに審議が行われ世界遺産リストに記載される,,,,,,,,,,,,,,,,,世界遺産リストに記載されるのと同時に、危機遺産リストにも記載される
基礎知識,世界遺産に関係する概念,緊急的登録の推薦書に記載が必要な内容,,,,,,,,,,,,,,,,,,"遺産の内容と正確な境界線
登録基準に照らした「顕著な普遍的価値」の証明
完全性と真正性の証明
保護管理体制についての説明
緊急性の性質や、遺産への被害と特定の危機の内容と程度、遺産を確実に保護するために世界遺産委員会が直ちに動かなければならない理由の説明"
基礎知識,世界遺産に関係する概念,遺産影響評価,,,,,,,,,,,,,,,,,,"「顕著な普遍的価値」の属性が受ける影響について評価するもの
遺産影響評価（HIA）を行うことで、「顕著な普遍的価値」の損失を防ぎ、持続可能な保護のための選択肢を見つけることができる
ガイダンスとツールキットの中では、「影響評価」とは「行動する前に考えること」とも説明されている
「顕著な普遍的価値」に対する正と負の両方の影響を特定し、負の影響の緩和措置を採らなければならない"
基礎知識,世界遺産に関係する概念,遺産影響評価の11の手順,,,,,,,,,,,,,,,,,,"スクリーニング
スコーピング
ベースライン
予定された行為と代替案
影響の特定と予測
影響評価
緩和と強化
報告
報告書のレビュー
意思決定
フォローアップ"
基礎知識,世界遺産リストへの推薦,アップストリーム・プロセス,,,,,,,,,,,,,,,,,,"暫定リストの作成や改訂、プレリミナリー・アセスメントの実施に前に任意で行われるプロセス
暫定リストへの記載準備から世界遺産登録までの全てのプロセスにおいて、諮問機関と世界遺産センターが締約国に直接働きかけて助言や能力強化などの協力を行うことができようにすること
アップストリーム・プロセスを受けて世界遺産登録されたのは、2013年の「ナミブ砂漠」が第1号"
基礎知識,世界遺産リストへの推薦,プレリミナリー・アセスメント（事前評価）,,,,,,,,,,,,,,,,,,"世界遺産リストへ推薦書を提出する前の全ての遺産に必須のプロセス
OUVが認められる可能性の有無や、具体的な助言・アドヴァイスを「事前評価報告書」として締約国に提供する
推薦書を提出する遺産の登録可能性を高める目的のほかに不均衡を是正する対策でもある
締約国と諮問機関の対話の機会強化が特徴"
