映画,隊商都市ペトラ,ヨルダン,(ⅰ)(ⅲ)(ⅳ),,ナバテア王国,,,,,,"宝物庫を意味するエル・ハズネ
 シークと呼ばれる砂岩が侵食されて形成されたもの
 「インディー・ジョーンズ/最後の聖戦」"
映画,カゼルタの18世紀の王宮と庭園、ヴァンヴィテッリの水道橋、サン・レウチョの関連遺産,イタリア,(ⅰ)(ⅱ)(ⅲ)(ⅳ),,ブルボン朝,,カルロス3世,,,,「スター・ウォーズ」
映画,武陵源：歴史的・景観的重要地区,中国,(ⅶ),,,,,チュウゴクオオサンショウウオ,,,「アバター」
映画,グウィネズのエドワード1世の城郭群,イギリス,(ⅰ)(ⅲ)(ⅳ),,,,エドワード1世,,,,「天空の城ラピュタ」
映画,北京と瀋陽の故宮,中国,(ⅰ)(ⅱ)(ⅲ)(ⅳ),,,,,,"紫禁城
 太和殿",,「ラストエンペラー」
映画,ダラム城と大聖堂,イギリス,(ⅱ)(ⅳ)(ⅵ),,,,,,,ノルマン様式,"「ハリー・ポッター」
 交差リブ・ヴォールトという独特な造り"
映画,スケリッグ・マイケル,アイルランド,(ⅲ)(ⅳ),,,,,,,,"「スター・ウォーズ：最後のジェダイ」
 ヨーロッパに現存する最古の修道院"
映画,ココス島国立公園,コスタリカ,(ⅸ)(ⅹ),,,,,ハンマーヘッド・シャークなどの軟骨魚類,,,"「ジュラシック・パーク」
 入島は厳しく制限されている"
映画,ヌビアの遺産群：アブ・シンベルからフィラエまで,エジプト,(ⅰ)(ⅲ)(ⅵ),,,,ラメセス2世,,,,「ナイル殺人事件」
映画,サン・ジミニャーノの歴史地区,イタリア,(ⅰ)(ⅲ)(ⅳ),,,,,,,,"「ムッソリーニとお茶を」
 皇帝派（ギベリン）と教皇派（ゲルフ）が内戦"
映画,マテーラの洞窟住居サッシと岩窟教会公園,イタリア,(ⅲ)(ⅳ)(ⅴ),,旧石器時代,,,,,,「007 NO TIME TO DIE」
映画,ドーセット及び東デヴォン海岸,イギリス,(ⅷ),,,,メアリー・アニング,イクチオサウルス,,,"「アンモナイトの目覚め」
 約1億8500万年にわたる中生代の地層"
映画,トマールのキリスト騎士団の修道院,ポルトガル,(ⅰ)(ⅵ),,,,,,サンタ・バルバラ回廊,マヌエル様式,「テリー・ギリアムのドン・キホーテ」
映画,青海フフシル（可可西里）,中国,(ⅶ)(ⅹ),,,,,チベットカモシカ（チルー）,,,「ココシリ」
映画,セゴビアの旧市街とローマ水道橋,スペイン,(ⅰ)(ⅲ)(ⅳ),,,,,,アルカサル,,「白雪姫」
海賊,シダーデ・ヴェーリャ、リベイラ・グランデの歴史地区,カーボヴェルテ,(ⅱ)(ⅲ)(ⅳ),,,,フランシス・ドレーク,,,,"ヨーロッパ諸国初の熱帯地域における植民都市
 クレオール文化"
海賊,パナマのカリブ海側の要塞群：ポルトベロとサン・ロレンツォ,パナマ,(ⅰ)(ⅳ),危機遺産,,,バッティスタ・アントネッリ,,サン・ロレンツォ要塞,,ヘンリー・モーガンなどの襲撃を受け要塞は何度も修復された
海賊,カルタヘナの港、要塞、歴史的建造物群,コロンビア,(ⅳ)(ⅵ),,,,フランシス・ドレーク,,,,ペドロ・デ・エレディアによって建設された港湾都市
海賊,アゾレス諸島の港町アングラ・ド・エロイズモ,ポルトガル,(ⅳ)(ⅵ),,,,,,"サン・セバスチアン要塞
 レデントール・デ・セ大聖堂",,
海賊,イビサ島の生物多様性と文化,スペイン,(ⅱ)(ⅲ)(ⅳ)(ⅸ)(ⅹ),,,,,ポシドニア・オセアニカ,プッチ・フダス・ムリンス,,ダルト・ビラにはアラブ風の街並や海賊対策の城壁が残されている
海賊,歴史的要塞都市カンペチェ,メキシコ,(ⅱ)(ⅳ),,,,フランシス・ドレーク,,,バロック様式,
海賊,ハバナの旧市街と要塞群,キューバ,(ⅳ)(ⅴ),,,,,,"フエルサ要塞
 モロ要塞",バロック様式,
海賊,パナマ・ビエホ考古遺跡とパナマの歴史地区,パナマ,(ⅱ)(ⅳ)(ⅵ),,,,ヘンリー・モーガン,,,コロニアル風,
嗜好品（コーヒー、茶、酒、たばこ）,サン・テミリオン地域,フランス,(ⅲ)(ⅳ),文化的景観,,,アウグストゥス,,,,"サンティアゴ・デ・コンポステーラへの巡礼路が通っている
 ジョン欠地王がブドウとワインの生産を保護した"
嗜好品（コーヒー、茶、酒、たばこ）,ジャテツとザーツ・ホープの景観,チェコ,(ⅲ)(ⅳ)(ⅴ),文化的景観,,,,,,,世界中でビール製造の使用されているホップ品種
嗜好品（コーヒー、茶、酒、たばこ）,ラヴォー地域のブドウ畑,スイス,(ⅲ)(ⅳ)(ⅴ),文化的景観,,,,,シヨン城,,シトー会
嗜好品（コーヒー、茶、酒、たばこ）,ピエモンテのブドウ園の景観：ランゲ・ロエロとモンフェッラート,イタリア,(ⅲ)(ⅴ),文化的景観,,,,,,,エルトリア人とケルト人の交易地
嗜好品（コーヒー、茶、酒、たばこ）,コロンビアのコーヒー農園の文化的景観,コロンビア,(ⅴ)(ⅵ),文化的景観,,,,,,,100年を超えるコーヒー農園の伝統を表す
嗜好品（コーヒー、茶、酒、たばこ）,キューバ南東部におけるコーヒー農園発祥地の景観,キューバ,(ⅲ)(ⅳ),文化的景観,,,,,,,キューバで初めてのコーヒープランテーション跡
嗜好品（コーヒー、茶、酒、たばこ）,ファン・ネレ工場,オランダ,(ⅱ)(ⅳ),,,,,,,,ガラスと鉄が用いられた大面積のカーテンウォールを有する
嗜好品（コーヒー、茶、酒、たばこ）,インドの山岳鉄道群,インド,(ⅱ)(ⅳ),,,,,,"ダージリン・ヒマラヤ鉄道
 ニルギリ鉄道
 カールカ・シムラ－鉄道",,紅茶の輸出や避暑地への快適な移動
嗜好品（コーヒー、茶、酒、たばこ）,アルト・ドウロのワイン生産地域,ポルトガル,(ⅲ)(ⅳ)(ⅴ),文化的景観,,,,,,,ドウロ川上流に位置しする2000年の歴史を持つワイン生産地である
嗜好品（コーヒー、茶、酒、たばこ）,普洱（プーアル）の景邁山古茶林の文化的景観,中国,(ⅲ)(ⅴ),文化的景観,,,,,,,"林下栽培
 茶祖信仰"
嗜好品（コーヒー、茶、酒、たばこ）,ビニャーレス渓谷,キューバ,(ⅳ),文化的景観,,,,,,,モゴーテ（断崖）と呼ばれる石灰岩の岩山が点在
嗜好品（コーヒー、茶、酒、たばこ）,ビャウォヴィエジャ森林保護区,ベラルーシ及びポーランド,(ⅸ)(ⅹ),,,,,,,,ヨーロッパ最大の森林地帯
嗜好品（コーヒー、茶、酒、たばこ）,リュウゼツランの景観とテキーラ村の古式産業施設群,メキシコ,(ⅱ)(ⅳ)(ⅴ)(ⅵ),文化的景観,,,,リュウゼツラン,,,
嗜好品（コーヒー、茶、酒、たばこ）,コネリアーノとヴァルドッビアーデネのプロセッコ栽培丘陵群,イタリア,(ⅴ),文化的景観,,,,,,,チリオーニと呼ばれる狭い草だらけの台地
嗜好品（コーヒー、茶、酒、たばこ）,武夷山,中国,(ⅲ)(ⅵ)(ⅶ)(ⅹ),,,,,,,,九曲渓
イスラム建築,イスファハーンのマスジェデ・ジャーメ（金曜モスク）,イラン・イスラム,(ⅱ),,セルジューク朝,,ニザーム・アル・ムルク,,"イマーム広場
 マスジェデ・ジャーメ",4イーワーン,イラン最古の金曜礼拝用モスク
イスラム建築,コルドバの歴史地区,スペイン,(ⅰ)(ⅱ)(ⅲ)(ⅳ),,西ゴート王国,,フェルナンド3世,,メスキータ,,
イスラム建築,ダマスカスの旧市街,シリア・アラブ,(ⅰ)(ⅱ)(ⅲ)(ⅳ)(ⅵ),危機遺産,ウマイヤ朝,,,,,,"旧約聖書
 シリアの世界遺産6件がすべて危機遺産リスト登録"
イスラム建築,ソルターニーイェ,イラン・イスラム,(ⅱ)(ⅲ)(ⅳ),,イル・ハン国,,,,,,
イスラム建築,エディネルのセリミエ・モスクとその関連施設,トルコ,(ⅰ)(ⅳ),,,,ミマール・スィナン,,,,
イスラム建築,ブハラの歴史地区,ウズベキスタン,(ⅱ)(ⅳ)(ⅵ),,サーマーン朝,,,,イスマーイール廟,,
イスラム建築,バゲルハット：モスクを中心とした歴史都市,バングラディシュ,(ⅳ),,,,ハン・ジャハーン・アリー,,ハリファターバッド,,
イスラム建築,デリーのフユマーン廟,インド,(ⅱ)(ⅳ),,,,,,,,ペルシアのインドの建築様式が融合している
イスラム建築,ファテープル・シークリー,インド,(ⅱ)(ⅲ)(ⅳ),,,,,,ブランド・ダルワーザ,,
イスラム建築,グラナダのアルハンブラ宮殿、ヘネラリーフェ離宮、アルバイシン地区,スペイン,(ⅰ)(ⅲ)(ⅳ),,グラナダ王国ナスル朝,,,,,アラベスク様式,
イスラム建築,フェズの旧市街,モロッコ,(ⅱ)(ⅴ),,イドリース朝,,イドリース2世,,,,
イスラム建築,ジェンネの旧市街,マリ,(ⅲ)(ⅳ),危機遺産,,ホゾ族,,,,スーダン様式,
イスラム建築,コートジボワール北部にあるスーダン様式のモスク群,コートジボワール,(ⅱ)(ⅳ),,,,,,,,サハラ交易生まれた様式
ヨーロッパの建築,シャルトルの大聖堂,フランス,(ⅰ)(ⅱ)(ⅳ),,,,,,シャルトルブルー,ゴシック様式,美しき絵ガラスの聖母
ヨーロッパの建築,ティヴォリのハドリアヌス別荘,イタリア,(ⅰ)(ⅱ)(ⅲ),,,,,,"ストア・ポイキレ
 カノプス",,
ヨーロッパの建築,ボイ渓谷のカタルーニャ風ロマネスク様式教会群,スペイン,(ⅱ)(ⅳ),,,,,,サン・クリメン教会,,イスラムの勢力が及ばずキリスト教の教会が数多く建てられた
ヨーロッパの建築,ヴァッセのアポロン・エピクリオス神殿,ギリシャ,(ⅰ)(ⅱ)(ⅲ),,,,,,,"ドーリア式
 イオニア式
 コリント式",
ヨーロッパの建築,フォントネーのシトー会修道院,フランス,(ⅳ),,,,,,,,シトー会最古の修道院
ヨーロッパの建築,トゥルネーのノートル・ダム大聖堂,ベルギー,(ⅱ)(ⅳ),,,,,,,"ロマネスク様式
 ゴシック様式",他地域に先駆けてゴシック様式で改築
ヨーロッパの建築,アフパットとサナインの修道院,アルメニア,(ⅱ)(ⅳ),,,,,,,,"アルメニアは4世紀初めにキリスト教を国教とした国
 聖十字架を奉納するためにアフパットの修道院が建設された
 アプシスには全能者ハリストスのフレスコ画がある"
ヨーロッパの建築,ダフニ、オシオス・ルカス、ヒオスのネア・モニの修道院群,ギリシャ,(ⅰ)(ⅳ),,,,,,オシオス・ルカス修道院,,内接十字形
ヨーロッパの建築,ブレナム宮殿,イギリス,(ⅱ)(ⅳ),,,,ジョン・ヴァンブラ,,,,イギリス式庭園
ヨーロッパの建築,ナンシーのスタニスラス広場、カリエール広場、アリアン巣広場,フランス,(ⅰ)(ⅳ),,,,スタニスラス・レシチニスキー,,,,
ヨーロッパの建築,レーゲンスブルク旧市街とシュタットアムホーム,ドイツ,(ⅱ)(ⅲ)(ⅳ),,,,,,,,神聖ローマ帝国議会が置かれた都市
ヨーロッパの建築,ブリュールのアウグストゥスブルク城と別邸ファルケンルスト,ドイツ,(ⅱ)(ⅳ),,,,クレメンス・アウグスト,,,,
ヨーロッパの建築,ムンバイにあるヴィクトリア朝ゴシックとアール・デコの建造物群,インド,(ⅱ)(ⅳ),,,,,,,ゴシック・リバイバル様式,
ヨーロッパの建築,プスコフ建築派の教会群,ロシア,(ⅱ),,,,,,,,プスコフ建築派によって築かれた教会や聖堂修道院などが残る
ヨーロッパの建築,パレルモのアラブ・ノルマン様式の建造物群と、チェファルとモンレアーレの大聖堂,イタリア,(ⅱ)(ⅳ),,,,シチリア王ルッジェーロ2世,,"チェファル大聖堂
 モンレアーレ大聖堂",,
ヨーロッパの建築,ウルネスの木造教会,ノルウェー,(ⅰ)(ⅱ)(ⅲ),,,,,,,ヴァイキング時代の建築法,ルストラフィヨルドを見下ろすノルウェー最古の木造教会
ヨーロッパの建築,キージ島の木造教会と集落,ロシア,(ⅰ)(ⅳ)(ⅴ),,,,,,プレオブラジェンスカヤ教会,,ポゴーストには釘を用いず複雑な木組みと装飾によって建てられた教会がある
近現代建築,フランク・ロイド・ライトの20世紀の建築,アメリカ,(ⅱ),,,,,,"落水荘
 ジェイコブス邸
 グッゲンハイム美術館
 ロビー邸",有機的建築,"水平ラインを強調するプレイリースタイルは機能主義の建築と対立する概念ととらえることができる
 自然の造形や原理に基づいている"
近現代建築,ブルノのトゥーゲントハート邸,チェコ,(ⅱ)(ⅳ),,,,ミース・ファン・デル・ローエ,,,,
近現代建築,建築家ヴィクトール・オルタによる主な邸宅（ブリュッセル）,ベルギー,(ⅰ)(ⅱ)(ⅳ),,,,,,,,"アール・ヌーヴォー建築の先駆け
 曲線装飾"
近現代建築,リートフェルト設計のシュレーダー邸,オランダ,(ⅰ)(ⅱ),,,,,,,,造形の純粋性を追求する芸術運動「デ・ステイル」の中心人物
近現代建築,アールフェルトのファーグス靴型工場,ドイツ,(ⅱ)(ⅳ),,,,ヴァルター・グロピウス,,,,
近現代建築,ルイス・バラガン邸と仕事場,メキシコ,(ⅰ)(ⅱ),,,,ルイス・バラガン,,,,
近現代建築,ベルリンのモダニズム公共住宅,ドイツ,(ⅱ)(ⅳ),,,,"ブルーノ・タウト
 マルティン・ヴァグナー
 ヴァルター・グロピウス",,,,
近現代建築,チャトラパティ・シヴァージー・ターミナス駅（旧名ヴィクトリア・ターミナス）,インド,(ⅱ)(ⅳ),,,,F・W・スティーヴンス,,,ゴシック・リバイバル様式,英国とインドの文化の融合
近現代建築,シュパイヒャーシュタットと、チリハウスのあるコントールハウス地区,ドイツ,(ⅳ),,,,,,,,シュパイヒャーシュタットと隣接する
近現代建築,リュブリャナにあるヨジェ・プレチニクの作品群：人間中心の都市デザイン,スロベニア,(ⅳ),,,,,,"三本橋
 スロベニア国立大学図書館",,"ウィーン分離派の影響を受ける
 オットー・ワーグナーに建築を学ぶ"
近現代建築,テル・アビーブの近代都市ホワイト・シティ,イスラエル,(ⅱ)(ⅳ),,,,,,,,イスラエルの気候条件に適合するようにつくられている
近現代建築,ブラジリア,ブラジル,(ⅰ)(ⅳ),,,,オスカー・ルシオ・コスタニーマイヤー,,,,上空から見ると飛行機型
近現代建築,アスマラ：アフリカのモダニズム都市,エリトリア,(ⅱ)(ⅳ),,,,,,,イタリア合理主義,
近現代建築,ダルムシュタットのマチルデンフーエ（マチルダの丘）,ドイツ,(ⅱ)(ⅳ),,,,ヘッセ大公エルンスト・ルートヴィヒ,,,,アーツ・アンド・クラフツ運動
近現代建築,技術者エラディオ・ディエステの作品：アトランティーダの教会,ウルグアイ,(ⅳ),,,,,,,,"ウルグアイで入手が容易なレンガにモルタルと鉄筋を組み合わせる
 ガウス・ヴォールト"
旧市街,エディンバラの旧市街と新市街,イギリス,(ⅱ)(ⅳ),,,,,,"エディンバラ城
 スクーンの石
 ホリールードハウス宮殿",,
旧市街,ラバト：近代の首都と歴史都市の側面を併せもつ都市,モロッコ,(ⅱ)(ⅳ),,,,アンリ・ブロスト,,,,"ムワッヒド城壁
 ウダイヤのカスバ"
旧市街,平遥の古代都市,中国,(ⅱ)(ⅲ)(ⅳ),,,,,,,,清代に金融業の中心として繁栄
旧市街,ルクセンブルク市の旧市街と要塞,ルクセンブルク,(ⅳ),,,,,,,イスパノ・モレスク様式,
旧市街,リヴィウ歴史地区,ウクライナ,(ⅱ)(ⅴ),危機遺産,,,,,リノック広場,"東欧の伝統的な様式
 バロック様式
 ルネサンス様式",1772年のポーランド分割によってオーストラリア帝国領
旧市街,タリンの歴史地区,エストニア,(ⅱ)(ⅳ),,,,,,,,"ドイツ騎士修道会
 トーンペア"
旧市街,クヴェートリンブルクの旧市街と聖堂参事会教会、城,ドイツ,(ⅳ),,,,ハインリヒ1世,,,ハーフティンバー様式,
旧市街,クスコの市街,ペルー,(ⅲ)(ⅳ),,,,パチャクテク,,,,インカ帝国の首都
旧市街,ラジャスタン州のジャイプール市街,インド,(ⅱ)(ⅳ)(ⅵ),,,,サワーイー・ジャイ・シング2世,,,,都市計画に従って築かれた街
旧市街,チュニスの旧市街,チュニジア,(ⅱ)(ⅲ)(ⅴ),,,,ハサン・イヴン・アル・ヌウマーン,,ザイトゥーナ・モスク,,
旧市街,ジッダの歴史地区：メッカの入り口,サウジアラビア,(ⅱ)(ⅳ)(ⅵ),,,,ウスマーン・イブン・アッファーン,,,,メッカ巡礼（ハッジ）の玄関口
旧市街,アッコの旧市街,イスラエル,(ⅱ)(ⅲ)(ⅴ),,オスマン帝国,,,,アル・ジャッザール・モスク,,十字軍の遺構の上に建てられた城塞都市
旧市街,ラムの旧市街,ケニア,(ⅱ)(ⅳ)(ⅵ),,,,,,,,サンゴ石とマングローブの木材
庭園,クロムニェジーシュの庭園と宮殿,チェコ,(ⅱ)(ⅳ),,,,,,"ポンペイの柱廊
 快楽の庭園",バロック様式,
庭園,ペルシア庭園,イラン・イスラム,(ⅰ)(ⅱ)(ⅲ)(ⅳ)(ⅵ),文化的景観,アケメネス朝ペルシア,,キュロス2世,,,,ゾロアスター教が重視した空・大地・水・植物の4つの要素に基づいて構成されている
庭園,杭州にある西湖の文化的景観,中国,(ⅱ)(ⅲ)(ⅵ),文化的景観,,,,,,,山水画のような世界
庭園,ホベルト・ブールリ・マルクスの庭園,ブラジル,(ⅱ)(ⅳ),文化的景観,,,ホベルト・ブールリ・マルクス,,,,ランドスケープデザイン
庭園,ティヴォリのエステ家別荘,イタリア,(ⅰ)(ⅱ)(ⅲ)(ⅳ)(ⅵ),,,,ピッロ・リゴーリオ,,オルガンの噴水,バロック様式,フランツ・リストが作曲したピアノ曲集に壮麗な噴水を表題した楽曲がある
庭園,ヴィルヘルムスヘーエ丘陵公園,ドイツ,(ⅲ)(ⅳ),文化的景観,,,,,,,油圧や空気圧を駆使して水が給料の斜面に設けられた水路に供給される
庭園,デッサウ・ヴェルリッツの庭園王国,ドイツ,(ⅱ)(ⅳ),文化的景観,,,レオポルト3世,,,,
庭園,トスカーナのメディチ家の別荘と庭園,イタリア,(ⅱ)(ⅳ)(ⅵ),文化的景観,,,,,,,メディチ家の12の別荘と2つの庭園
庭園,ファウンテン図修道院の廃墟のあるスタッドリー・ロイヤル公園,イギリス,(ⅰ)(ⅳ),,,,ジョン・エイズラビー,,,,1983年にナショナル・トラストの所有物となる
庭園,マフラの王家の建物：宮殿、バシリカ、女子修道院、セルコ庭園、狩猟公園（タパダ）,ポルトガル,(ⅳ),,,,,,"セルコ庭園
 タパダ",バロック様式,
庭園,シーギリヤの古代都市,スリランカ,(ⅱ)(ⅲ)(ⅳ),,シンハラ王国,,カッサパ1世,,"水の庭園
 シーギリヤ・レディ",,
庭園,ゴレスタン宮殿,イラン・イスラム,(ⅱ)(ⅲ)(ⅳ),,カージャール朝,,シャー・ジャハーン帝,,,,初期ペルシア工芸品と西洋建築技術の融合
庭園,承徳の避暑山荘と外八廟,中国,(ⅱ)(ⅳ),,,,,,溥仁寺,,中国全土の縮図といえる景観
庭園,ラホール城とシャーラマール庭園,パキスタン,(ⅰ)(ⅱ)(ⅲ),,,,,,,,ペルシア式泉水庭園
庭園,昌徳宮,韓国,(ⅱ)(ⅲ)(ⅳ),,,,,,秘苑,,
庭園,山寺（サンサ）：韓国の山岳僧院群,韓国,(ⅲ),,,,,,"通度寺
 浮石寺
 鳳停寺
 法住寺
 麻谷寺
 仙岩寺
 大興寺",,マダンという韓国特有の庭園
神話・伝説,ジャイアンツ・コーズウェイとその海岸,イギリス,(ⅶ)(ⅷ),,,,,,,,"正六角形をした約4万本の玄武岩の石柱
 巨人伝説にちなんで巨人の石道と名付けられた"
神話・伝説,エオーリエ諸島,イタリア,(ⅷ),,,,,,,,ストロンボリ諸島
神話・伝説,アマルフィ海岸,イタリア,(ⅱ)(ⅳ)(ⅴ),文化的景観,,,,,アマルフィ大聖堂,,
神話・伝説,ヘラクレスの塔,スペイン,(ⅲ),,,,,,,,世界最古の灯台
神話・伝説,ライン渓谷中流上部,ドイツ,(ⅱ)(ⅳ)(ⅴ),文化的景観,,,,,,,ローレライ伝説
神話・伝説,デルフィの考古遺跡,ギリシャ,(ⅰ)(ⅱ)(ⅲ)(ⅳ)(ⅵ),,,,,,アポロン神殿,,ピュティア
神話・伝説,アフロディシアス,トルコ,(ⅱ)(ⅲ)(ⅳ)(ⅵ),,,,,,,,アフロディーテ信仰を通してローマ帝国と緊密な関係を結ぶ
神話・伝説,ランス・オー・メドー国立歴史公園,カナダ,(ⅵ),,,,ヴァイキング,,,,北アメリカにおける最初のヨーロッパ人の入植地
神話・伝説,ラリベラの岩の聖堂群,エチオピア,(ⅰ)(ⅱ)(ⅲ),,サグウェ朝,,,,キョルギス聖堂,アクスム王国の様式,
神話・伝説,バアルベック,レバノン,(ⅰ)(ⅳ),,,,,,ユピテル神殿,コリント式,
神話・伝説,サナアの旧市街,イエメン,(ⅳ)(ⅴ)(ⅵ),危機遺産,,,,,スーク・アル・ミルフ,,"アベドという日干しレンガを積み上げて作られた高層住宅
 乳香貿易"
神話・伝説,聖山スレイマン・トー,キルギス,(ⅲ)(ⅵ),,,,,,,,"中央アジアの聖山の典型
 民間信仰とイスラム教信仰が混在"
神話・伝説,黄山,中国,(ⅲ)(ⅶ)(ⅹ),,,,,,,,黄山四絶（奇松怪石雲海温泉）が黄山の景色を特徴づけている
神話・伝説,元の上都遺跡,中国,(ⅱ)(ⅲ)(ⅳ)(ⅵ),,,,フビライ・ハン,,,,
神話・伝説,砂漠の城クセイル・アムラ,ヨルダン,(ⅰ)(ⅲ)(ⅳ),,ウマイヤ朝,,,,,,イスラム社会では珍しい図柄のフレスコ画
神話・伝説,クサントスとレトーン,トルコ,(ⅱ)(ⅲ),,,リュキア人,,,,,
聖山,モン・サン・ミシェルとその湾,フランス,(ⅰ)(ⅲ)(ⅵ),,,,ノルマンディー公リシャール1世,,ノートル・ダム・ス・テール聖堂,ノルマンディー・ロマネスク建築,"修道士の瞑想の場である最上階の回廊
 ベネディクト会"
聖山,ピエモンテとロンバルディアのサクロ・モンテ群,イタリア,(ⅱ)(ⅳ),文化的景観,,,,,ヴァラッロ・セジアのサクロ・モンテ,,イスラム教徒の勢力によりエルサレムなどへの聖地巡礼が難しくなったため代替としてつくられた
聖山,メテオラの修道院群,ギリシャ,(ⅰ)(ⅱ)(ⅳ)(ⅴ)(ⅶ),,,,,,"メタモルフォシス修道院
 アギオス・ステファノス修道院",クレタ様式,イコン
聖山,聖山アトス,ギリシャ,(ⅰ)(ⅱ)(ⅳ)(ⅴ)(ⅵ)(ⅶ),,,,,,,,女人禁制
聖山,ブラガのボン・ジェズス・ド・モンテ聖域,ポルトガル,(ⅳ),文化的景観,,,,,,,カトリック教会によって進められた聖山（サクロ・モンテ）を築く運動
聖山,聖カトリーナ修道院地域,エジプト・アラブ,(ⅰ)(ⅲ)(ⅳ)(ⅵ),,,,,,,,シナイ山北麓にあるキリスト教修道院
聖山,マプングブエの文化的景観,南アフリカ,(ⅱ)(ⅲ)(ⅳ)(ⅴ),文化的景観,,,,,,,象牙や金時期やガラス玉などの交易品が多数出土
聖山,ナンダ・デヴィ国立公園と花の谷国立公園,インド,(ⅶ)(ⅹ),,,,,"シャクナゲ
 ユキヒョウ
 ジャコウジカ",,,女神ナンダが住む聖地
聖山,カンチェンジュンガ国立公園,インド,(ⅲ)(ⅳ)(ⅶ)(ⅹ),,,,,,,,神話が伝える神聖さや教訓は仏教の教えと同化しシッキムの民の文化の礎となった
聖山,チャムパーサックの文化的景観にあるワット・プーと関連古代遺跡群,ラオス,(ⅲ)(ⅳ)(ⅵ),文化的景観,,,,,,,カオ山（プー・カオ）
聖山,武当山の道教寺院群,中国,(ⅰ)(ⅱ)(ⅵ),,,,永楽帝,,,,
聖山,五台山,中国,(ⅱ)(ⅲ)(ⅳ)(ⅵ),文化的景観,,,,,,,文殊菩薩の聖地
宗教,キーウ：聖ソフィア聖堂と関連遺産群、キーウ・ペチェルーシク大修道院,ウクライナ,(ⅰ)(ⅱ)(ⅲ)(ⅳ),危機遺産,キエフ大公国,,ヤロスラフ賢公,,,ビザンツ様式とロシアの伝統様式が融合,"オランス（祈り）
 キーウ・ルーシ"
宗教,リラの修道院,ブルガリア,(ⅵ),,,,フレリヨ・ドラゴボラ,,聖母聖堂,,"イワンは死後イワン・リルスキーとして聖人に列せられた
 ブルガリア正教"
宗教,ヤヴォルとシフィドニツァの平和教会,ポーランド,(ⅲ)(ⅳ)(ⅵ),,,,,,,,"砦にならないよう頑丈な石製にすることは禁じられた
 三十年戦争"
宗教,ヒルデスハイムの聖マリア大聖堂と聖ミヒャエル聖堂,ドイツ,(ⅰ)(ⅱ)(ⅲ),,,,ベルンヴァルト,,,,
宗教,シュパイア、ヴォルムス、マインツのユダヤ人共同体（シュム）関連遺産群,ドイツ,(ⅱ)(ⅲ)(ⅵ),,,ユダヤ人,,,,,アシュケナジムのコミュニティが存在した
宗教,アルコバサの修道院,ポルトガル,(ⅰ)(ⅳ),,,,,,,,太ると通ることのできない細い食堂の入口がシトー会の主義を示す
