アメリカ,先住民族の遺跡（中米）,ティオティワカンの古代都市,メキシコ,(ⅰ)(ⅱ)(ⅲ)(ⅳ)(ⅵ),,,アステカ帝国,,,,,,,,,タルー・タブレロ式,,ケツァルコアトル,,400以上もの黒曜石の加工場が見つかっていることから、黒曜性の交易を独占したことが繁栄につながったと考えられる
アメリカ,先住民族の遺跡（中米）,ソチカルコの古代遺跡地帯,メキシコ,(ⅲ)(ⅳ),,,,,,,,,,,,,,ケツァルコアトル,,"マヤの特徴を備えた神官、統治者、天文学者と解釈される姿が彫られている
花々の館を意味する"
アメリカ,先住民族の遺跡（中米）,タカリク・アバフ国立公国公園,グアテマラ,(ⅱ)(ⅲ),,,"オルメカ文明
マヤ文明",,,,,,石碑5,,,,,,,今日のエルサバドルとをつなぐ長距離交易の中継地であった
アメリカ,先住民族の遺跡（中米）,パキメの遺跡,メキシコ,(ⅲ)(ⅳ),,,,,,,,,日干しレンガ（アドべ）の集合住宅,,,,プエブロ文化,,,精巧な水利システムが備わっている
アメリカ,先住民族の遺跡（中米）,エル・タヒンの古代都市,メキシコ,(ⅲ)(ⅳ),,,,"トトナカ人
ワステカ人",,,,,壁龕のピラミッド,,,,,,,
アメリカ,先住民族の遺跡（中米）,ディキスの石球のある先コロンブス期の首長制集落群,コスタリカ,(ⅲ),,,,,,,,,フィンカ6,,,,,,,首長は力関係に応じた階層的な集落を形成
アメリカ,先住民族の遺跡（中米）,オアハカの中部渓谷にあるヤグルとミトラの先史洞窟,メキシコ,(ⅲ),,文化的景観,,,,,,,"ギラ・ナキツ洞窟
ヤグル遺跡",植物栽培の証拠/モンテ・アルバンが放棄され、小都市が勢力を伸ばしたことを示す遺跡が残る,,,,,,遊牧狩猟民族が農耕定住民へと移行したことを示す
アメリカ,先住民族の遺跡（中米）,サンフランシスコ山地の洞窟壁画,メキシコ,(ⅰ)(ⅲ),,,,コチミ族,フランシスコ・ハビエル・クラビヘロ,,,,,,,,,,,太古のメキシコ芸術をあらわしている
アメリカ,先住民族の遺跡（南米）,ナスカとパルパの地上絵,ペルー,(ⅰ)(ⅲ)(ⅳ),,,,,,"アルフレッド・クローバー
マリア・ライへ",,,,,,,ナスカ文化,,,褐色の小石を取り除くと、白い砂が露出する
アメリカ,先住民族の遺跡（南米）,ラパ・ニュイ国立公園,チリ,(ⅰ)(ⅲ)(ⅴ),,,,,,,,,バスクア島,,,,,,,"ラノ・ララク火山の周辺で採れる、柔らかくて削りやすい凝灰岩が使われている
人口増加による食糧難に陥ると「フリ・モアイ」が行われた"
アメリカ,先住民族の遺跡（南米）,聖都カラル・スぺ,ペルー,(ⅱ)(ⅲ)(ⅳ),,,,,,,,,カラル,,,,,,,アメリカ大陸に興った文明の中でも最も古いものの1つ
アメリカ,先住民族の遺跡（南米）,チャビンの考古遺跡,ペルー,(ⅲ),,,アンデス文明,,,,,,,,,,,ランソン,,
アメリカ,先住民族の遺跡（南米）,ティワナク：ティワナク文化の宗教的・政治的中心地,ボリビア,(ⅲ)(ⅳ),,,,,,,,,"アカパナ
太陽の門",,,,,,,
アメリカ,先住民族の遺跡（南米）,チャンチャンの考古地区,ペルー,(ⅰ)(ⅲ),,危機遺産,チムー王国,,,,,,ラ・シウダデラ,,,,,,,
アメリカ,先住民族の遺跡（南米）,ティエラデントロ国立公園,コロンビア,(ⅲ),,,,,,,,,セゴビアの円形墓地,,,,,,,
アメリカ,先住民族の遺跡（南米）,サン・アグスティン考古公園,コロンビア,(ⅲ),,,,,,,,,,,,,,,,400もの石像からなる南米最大規模の遺跡群
アメリカ,先住民族の遺跡（南米）,サパイマタの砦,ボリビア,(ⅱ)(ⅲ),,,,,,,,,,,,,,,,石英を含む赤味がかった砂岩層にさまざまな彫刻が施された
アメリカ,先住民族の遺跡（南米）,チャンキーヨの天文考古学遺産群,ペルー,(ⅰ)(ⅳ),,,,,,,,,,,,,,,,"13基の塔は人工的な地平線としての役割を持つ
セロ・ムーチョ・マロから日が昇るといったように、塔と太陽の位置で1年の日付を把握していた"
アメリカ,先住民族の遺跡（南米）,セラ・ダ・カピバラ国立公園,ブラジル,(ⅲ),,,,,,,,,,,,,,,,"アメリカ大陸での人類の起源が塗り替えられることとなった
世界最多の洞窟壁画を擁する"
アメリカ,先住民族の遺跡（南米）,ピントゥラス川のクエバ・デ・ラス・マノス,アルゼンチン,(ⅲ),,,,,,,,,手の洞窟,,,,,,,800以上の手形が残る
アメリカ,先住民族の遺跡（南米）,アリカ・イ・パリナコータ州におけるチンチョーロ文化の集落と人工ミイラ製造技術,チリ,(ⅲ)(ⅴ),,,,,,,,,アタカマ砂漠,,,,,,,性別や社会階層を問わず、乳幼児を含むさまざまな遺体がミイラ処理を施されている
アメリカ,先住民族の遺跡（南米）,カパック・ニャン：アンデスの道,"アルゼンチン
エクアドル
コロンビア
チリ
ペルー
ボリビア",(ⅱ)(ⅲ)(ⅳ)(ⅴ),,,,,,,,,インカ道,,,,,,,"地域住民による伝統的な保護や維持活動は評価された
273もの構成資産からなるシリアル・ノミネーション・サイト"
アメリカ,先住民族の遺跡（南米）,ケブラーダ・デ・ウマウアカ,アルゼンチン,(ⅱ)(ⅳ)(ⅴ),,文化的景観,,,,,,,プカラ,,,,,,,"1万年以上にわたって渓谷が交易路として使用されてきた
インカ帝国が滅亡するとアルト・ペルーと内陸部をつなぐルートとなった"
アメリカ,マヤ文明に関する遺産,チチェン・イツァの古代都市,メキシコ,(ⅰ)(ⅱ)(ⅲ),セノーテ,,,,,,,,"エル・カスティーリョ
カラコル",,チャクモール像,,,,,ユカタン半島最大級のセノーテのほとりに築かれた
アメリカ,マヤ文明に関する遺産,パレンケの古代都市と国立公園,メキシコ,(ⅰ)(ⅱ)(ⅲ)(ⅳ),,,,,パカル王,,,,碑文の神殿,パレンケ王家の歴史が記されたマヤン文字の碑文が発見された,,,,,,
アメリカ,マヤ文明に関する遺産,ウシュマルの古代都市,メキシコ,(ⅰ)(ⅱ)(ⅲ),,,,,,,,,"魔法使いのピラミッド
尼僧院",,,プウク様式,,,,
アメリカ,マヤ文明に関する遺産,コパンのマヤ遺跡,ホンジュラス,(ⅳ)(ⅵ),,,,,"ヤシュ・クック・モー（ケツァル・パパガヨ）大王
ワシャクラフン・ウバーフ・カウィル王（18ウサギ王）",,,,,,,,,,,神聖文字の階段には、62段の階段に2200以上ものマヤ文字が刻まれている
アメリカ,マヤ文明に関する遺産,キリグア遺跡公園,グアテマラ,(ⅰ)(ⅱ)(ⅳ),,,,,カック・ティリウ,,,,石碑E,,,,,,,
アメリカ,マヤ文明に関する遺産,ホヤ・デ・セレンの考古地区,エルサルバドル,(ⅲ)(ⅳ),,,,,,,,,,,,,,,,"マヤ文明の農村生活を伝える遺跡
ロマ・カルデラ火山噴火以降火山灰に埋もれていた"
アメリカ,入植の歴史（北米）,ケベック旧市街の歴史地区,カナダ,(ⅳ)(ⅵ),,,,,,,,,シャトー・フロントナック,,,,,,,"ヌーヴェル・フランスの要衝として建設後イギリス領となった
ケベック法により、フランスの文化が認められている"
アメリカ,入植の歴史（北米）,ランス・オー・メドー国立歴史公園,カナダ,(ⅵ),,,,ヴァイキング,,,,,,,,,,,,
アメリカ,入植の歴史（北米）,グラン・プレの景観,カナダ,(ⅴ)(ⅵ),,,,アカディア人,,,,,,,,,,,,
アメリカ,入植の歴史（北米）,ルーネンバーグの旧市街,カナダ,(ⅴ)(ⅵ),,,,,,,,,,,,ヴィクトリア朝建築,,,,
アメリカ,入植の歴史（中米）,メキシコ・シティの歴史地区とソチミルコ,メキシコ,(ⅱ)(ⅲ)(ⅳ)(ⅴ),,,アステカ帝国,,,,,,"ソカロ
テンプロ・マヨール
",,,,,,,テノチティトランが存在した
アメリカ,入植の歴史（中米）,植民都市サント・ドミンゴ,ドミニカ共和国,(ⅱ)(ⅳ)(ⅵ),,,,,,,,,サン・ニコラス・デ・バリ病院,,,,,,,新大陸最古のスペイン植民地政策の活動拠点となった
アメリカ,入植の歴史（中米）,レオン・ビエホの遺跡群,ニカラグア,(ⅲ)(ⅳ),,,,,,,,,ラ・メルセー教会,,,,,,,モモトンボ火山の噴火と1610年の地震により壊滅した
アメリカ,入植の歴史（中米）,カマグエイの歴史地区,キューバ,(ⅳ)(ⅴ),,,,,,,,,,,,"新古典主義
アール・デコ
ネオ・コロニアル",,,,
アメリカ,入植の歴史（中米）,プエブラの歴史地区,メキシコ,(ⅱ)(ⅳ),,,,,,,,,ロザリオの聖母礼拝堂,,,,,,,街の装飾は粘土とアズレージョが融合したもの
アメリカ,入植の歴史（中米）,グアナフアトの歴史地区と鉱山,メキシコ,(ⅰ)(ⅱ)(ⅳ)(ⅵ),,,,,,,,,"バレンシアナ教会堂
グアナフアト大学",,,,,,,フェリペ2世が寄進した聖母像が祀られている
アメリカ,入植の歴史（中米）,サカテカスの歴史地区,メキシコ,(ⅱ)(ⅳ),,,,,,,,,,,,チュリゲラ様式,,,,バラ色の街とも呼ばれる
アメリカ,入植の歴史（中米）,シエンフエゴスの歴史地区,キューバ,(ⅱ)(ⅳ),,,,,,,,,,,,,,,,"19世紀の砂糖ブームで繫栄した
フランス人移民の発想で造られた地区は碁盤目状に区切られている"
アメリカ,入植の歴史（中米）,オアハカの歴史地区とモンテ・アルバンの考古遺跡,メキシコ,(ⅰ)(ⅱ)(ⅲ)(ⅳ),,,,,,,,,ラ・ソレダー教会堂,,,,,,,耐震設計
アメリカ,入植の歴史（中米）,ケレタロの歴史的建造物地区,メキシコ,(ⅱ)(ⅳ),,,,,,,,,サンタ・クララ教会堂,,,ケレタロ流バロック,,,,
アメリカ,入植の歴史（中米）,モレリアの歴史地区,メキシコ,(ⅱ)(ⅳ)(ⅵ),,,,,,,,,モレリア大聖堂,,,,,,,メキシコ独立運動の中心地の1つ
アメリカ,入植の歴史（中米）,アンティグア・グアテマラ,グアテマラ,(ⅱ)(ⅲ)(ⅳ),,,,,,,,,ラ・メルセー教会,,,,,,,耐震性を高めて建造物が改築された
アメリカ,入植の歴史（中米）,パナマ・ビエホ考古遺跡とパナマの歴史地区,パナマ,(ⅱ)(ⅳ)(ⅵ),,,,,,,,,コロニアル風の大聖堂,,,,,,,ヘンリー・モーガンに襲われて廃墟と化した
アメリカ,入植の歴史（中米）,トラコタルパンの歴史的建造物地区,メキシコ,(ⅱ)(ⅳ),,,,,,,,,コロンブス広場,,,,,,,水に囲まれた土地という意味を持つ
アメリカ,入植の歴史（中米）,カミノ・レアル・デ・ティエラ・アデントロ‐メキシコ内陸部の王の道,メキシコ,(ⅱ)(ⅳ),,,,,,,,,,,,,,,,"1400㎞に及ぶ区間にある鉱山や聖堂、修道院、墓地、橋、市街などの55の遺跡と、5つの既存の世界遺産登録地
銀山で産出された銀や、ヨーロッパから輸入された銀の精製に使われた水銀の輸送路として使用された
ルート沿いには他民族の街がいくつも建設された"
アメリカ,入植の歴史（南米）,クスコの市街,ペルー,(ⅲ)(ⅳ),,,,,パチャクテク,,,,サクサイワマン,,,,,,,"フランシスコ・ピサロがわずか168人の兵士を連れてこの地を占領し、インカ帝国は滅亡した
インカ帝国の首都として栄えた地"
アメリカ,入植の歴史（南米）,キトの市街,エクアドル,(ⅱ)(ⅳ),,,,キトス族,,,,,大聖堂/サン・フランシスコ修道院/ラ・コンパニーア教会堂,カピスカラの「ラ・サバナ・サンタ」が飾られている/キト派という様式と集団を生み出した/,,,,,,インカ第2の都市として繁栄した
アメリカ,入植の歴史（南米）,リマの歴史地区,ペルー,(ⅳ),,,,,フランシスコ・ピサロ,,,,サン・フランシスコ修道院,,,,,,,1542年にペルー副王領の首都となる
アメリカ,入植の歴史（南米）,アレキパの歴史地区,ペルー,(ⅰ)(ⅳ),,,,,,,,,アルマス広場,,,,,,,1582年の地震後シラーという耐震性がある素材が使用された
アメリカ,入植の歴史（南米）,クエンカのサンタ・アナ・デ・ロス・リオス歴史地区,エクアドル,(ⅱ)(ⅳ)(ⅴ),,,,,カルロス5世,,,,,,,,,,,抗マラリア薬のキニーネとパナマ帽の生産と産出で栄えた
アメリカ,入植の歴史（南米）,ポトシの市街,ボリビア,(ⅱ)(ⅳ)(ⅵ),,危機遺産,,,,フランシスコ・デ・トレド,,,セロ・リコ,,,,,,,アマルガム法により約100年間で世界の銀産出量の半分を占める銀が産出された
アメリカ,入植の歴史（南米）,スクレの歴史都市,ボリビア,(ⅳ),,,,,アントニオ・ホセ・デ・スクレ,,,,,,,,,,,司教座設置が決まるとキリスト教布教活動の中心地になった
アメリカ,入植の歴史（南米）,ゴイアスの歴史地区,ブラジル,(ⅱ)(ⅳ),,,,,,,,,サン・タナ大聖堂,,,コロニアル調,,,,
アメリカ,入植の歴史（南米）,オウロ・プレトの歴史都市,ブラジル,(ⅰ)(ⅲ),,,,,,,,,ノッサ・セニョーラド・ピラール教会堂,,,,,,,
アメリカ,入植の歴史（南米）,ディアマンティーナの歴史地区,ブラジル,(ⅱ)(ⅳ),,,,,,,,,聖フランシス教会,,,,,,,ダイヤモンド採掘で栄えた都市
アメリカ,入植の歴史（南米）,サン・クリストヴァンのサン・フランシスコ広場,ブラジル,(ⅱ)(ⅳ),,,スペイン・ポルトガル同君連合時代,,,,,,サンタ・カーザ・ダ・ミゼリコディア協会,,,,,,,
アメリカ,入植の歴史（南米）,コロニア・デル・サクラメントの歴史地区,ウルグアイ,(ⅳ),,,,,,,,,サンティシモ・サクラメント大聖堂,,,,,,,ポルトガルがスペイン領内に築いた港湾都市
アメリカ,入植の歴史（南米）,オリンダの歴史地区,ブラジル,(ⅱ)(ⅳ),,,,,ペレイラ,,,,,,,,,,,ポルトガル植民地として砂糖産業で繁栄した
アメリカ,入植の歴史（南米）,サン・ルイスの歴史地区,ブラジル,(ⅲ)(ⅳ)(ⅴ),,,,,,,,,,,,,,,,"ブラジルで唯一フランス人が建設した植民都市
砂糖と綿花の貿易港として繁栄した"
アメリカ,入植の歴史（南米）,サンドヴァドル・デ・バイアの歴史地区,ブラジル,(ⅳ)(ⅵ),,,,,,,,,サルヴァドル大聖堂,,,,,,,"植民地ブラジルの最初の首都として繁栄した
1588年に新大陸初の奴隷市場が設けられた"
アメリカ,入植の歴史（南米）,パラマリボの歴史街区,スリナム,(ⅱ)(ⅳ),,,,,,,,,,,,,クレオール文化,,,
アメリカ,入植の歴史（南米）,ヨルサファナの考古学的遺跡：ヨルサファナの入植地とカシポラ・クリークの墓地,スリナム,(ⅲ),,,,,,セファルディム,,,ベラハ・ヴェシャローム・シナゴーグ,,,,,,,
アメリカ,入植の歴史（南米）,ヴァロンゴ埠頭の考古遺跡,ブラジル,(ⅵ),,負の遺産,,,,,,,,,,,,,,"アフリカ人奴隷を上陸させるため石造の埠頭が築かれ始めた
ドン・ペドロ2世の妻を迎えるため「皇后の埠頭」が建設された"
アメリカ,入植の歴史（南米）,海港都市バルパライソの歴史地区,チリ,(ⅲ),,,,,,,,,アセンソール,,,,,,,パナマ運河開通までこの地域に大きな商業的影響を与えた
アメリカ,入植の歴史（南米）,コロとその港,ベネズエラ,(ⅳ)(ⅴ),,危機遺産,,,,,,,太陽の家,,,,,,,ラ・ベラ港には、オランダ風建築様式の税関事務所や礼拝堂がある
アメリカ,入植の歴史（南米）,サンタ・クルス・デ・モンボスの歴史地区,コロンビア,(ⅳ)(ⅴ),,,,,フアン・デ・サンタ・クルス,,,,,,,,,,,マグダレナ川河口から約200km上流にある
アメリカ,要塞と軍事関連遺産,カルタヘナの港、要塞、歴史的建造物群,コロンビア,(ⅳ)(ⅵ),,,,,ペドロ・デ・エレディア,,,,サン・フェリペ要塞,,,,,,,フランシス・ドレークによって要塞が破壊・占領された
アメリカ,要塞と軍事関連遺産,ハバナの旧市街と要塞群,キューバ,(ⅳ)(ⅴ),,,,,ディエゴ・ベラスケス,,,,フエルサ要塞,,,,,,,
アメリカ,要塞と軍事関連遺産,パナマのカリブ海側の要塞群：ポルトベロとサン・ロレンツォ,パナマ,(ⅰ)(ⅳ),,危機遺産,,,,バッティスタ・アントネッリ,,,サン・ロレンツォ要塞,,,,,,,
アメリカ,要塞と軍事関連遺産,プエルト・リコの要塞とサン・フアン国立歴史地区,アメリカ,(ⅵ),,,,,,バッティスタ・アントネッリ,,,"ラ・フォルタレサ要塞
エル・モロ要塞",,,,,,,
アメリカ,要塞と軍事関連遺産,サンティアゴ・デ・クーバのサン・ペドロ・デ・ラ・ロカ城,キューバ,(ⅳ)(ⅴ),,,,,フェリペ2世,フアン・バッティスタ・アントネッリ,,,,,,,,,,堅牢さと機能美を併せもつ
アメリカ,要塞と軍事関連遺産,歴史的要塞都市カンペチェ,メキシコ,(ⅱ)(ⅳ),,,,,,,,,,,,,,,,"スペイン本国と植民地を結ぶ貿易拠点
フランシス・ドレークなどの海賊からたびたび襲撃された"
アメリカ,要塞と軍事関連遺産,リドー運河,カナダ,(ⅰ)(ⅳ),,,,,,,,,47の堰,,,,,,,北アメリカで最も古い、1832年開通の運河
アメリカ,要塞と軍事関連遺産,歴史都市ブリッジタウンとその要塞,バルバドス,(ⅱ)(ⅲ)(ⅳ),,,,,,,,,,,,,,,,街路は不規則に配置されている
アメリカ,要塞と軍事関連遺産,ブリムストーン・ヒル要塞国立公園,セントクリストファー・ネーヴィス,(ⅲ)(ⅳ),,,,,,,,,,,,,,,,アフリカ人奴隷によって1世紀以上にわたり、拡張工事が行われ、巨大要塞となった
アメリカ,要塞と軍事関連遺産,アンティグアの海軍造船所と関連考古遺跡群,アンティグア・バーブーダ,(ⅲ)(ⅳ),,,,,,,,,,,,,,,,ハリケーンの被害を和らげる自然のシェルターの役割を果たしている
アメリカ,経済活動関連遺産,パドレ・テンブレケ水利施設の水道橋,メキシコ,(ⅰ)(ⅱ)(ⅳ),,,,,,フランシスコ・デ・テンブレケ,,,テペヤワルコのアーチ型水道橋,,,,,,,一段のアーチで築かれた水路としては最も高いもの
アメリカ,経済活動関連遺産,トリニダとロス・インへニオス渓谷,キューバ,(ⅳ)(ⅴ),,,,,,,,,イスナガの塔,,,,,,,ロス・インへニオス渓谷で黒人奴隷によるサトウキビ栽培がおこなわれた
アメリカ,経済活動関連遺産,レッド・ベイのバスク人捕鯨基地,カナダ,(ⅲ)(ⅳ),,,,,,,,,,,,,,,,"船の残骸やクジラの骨が堆積している
グラン・ベイヤと呼ばれていた"
アメリカ,経済活動関連遺産,セウェル鉱山都市,チリ,(ⅱ),,,,,,,,,エル・テニエンテ銅山,,,,,,,アメリカを彷彿とさせるカラフルな街並み
アメリカ,経済活動関連遺産,ハンバーストーンとサンタ・ラウラの硝石工場群,チリ,(ⅱ)(ⅲ)(ⅳ),,,,,,,,,,,,,パンピノス文化,,,化学肥料として欧米に輸出された
アメリカ,経済活動関連遺産,トロンデック・クロンダイク,カナダ,(ⅳ),,,,トロンデック・フェッチン族,,,,,,,,,ゴールド・ラッシュ,,,
アメリカ,経済活動関連遺産,フライ・ベントスの産業景観,ウルグアイ,(ⅱ)(ⅳ),,文化的景観,,,,,,,"食肉加工工場
リービッヒ肉エキス会社",,,,,,,
アメリカ,新大陸のキリスト教とミッション,グアラニのイエズス会布教施設群：サン・イグナシオ・ミニ、サンタ・アナ、ヌエストラ・セニョーラ・デ・ロレト、サンタ・マリア・マヨール（アルゼンチン側）、サン・ミゲル・ダス・ミソンイス（ブラジル側）,"アルゼンチン
ブラジル",(ⅳ),,,,,,,,,"サン・ミゲル・ダス・ミソンイス
サン・イグナシオ・ミニ",,,,レドゥクシオン,,,
アメリカ,新大陸のキリスト教とミッション,パラナ川沿いのイエズス会布教施設群：ラ・サンティシマ・トリニダ・デ・パラナとヘスス・デ・タバランゲ,パラグアイ,(ⅳ),,,,,,,,,"ラ・サンティシマ・トリニダ聖堂
サン・コスメ・イ・ダミアン",,,,レドゥクシオン,,,
アメリカ,新大陸のキリスト教とミッション,コルドバのイエズス会管区教会堂と農園跡,アルゼンチン,(ⅱ)(ⅳ),,,,,,,,,イエズス会神学校,,,,エスタンシア,,,
アメリカ,新大陸のキリスト教とミッション,チキトスのイエズス会ミッション,ボリビア,(ⅳ)(ⅴ),,,,,,,,,,,,メスティソ様式,レドゥクシオン,,,
アメリカ,新大陸のキリスト教とミッション,チロエの教会堂群,チリ,(ⅱ)(ⅲ),,,,,,,,,カストロ教会堂,,,チロエ様式,,,,
アメリカ,新大陸のキリスト教とミッション,ゴンゴーニャスのボン・ジェズス聖域,ブラジル,(ⅰ)(ⅳ),,,,,,,,,ボン・ジェズス・ジ・マトジーニョス教会堂,,,,,,,
アメリカ,新大陸のキリスト教とミッション,レオン大聖堂,ニカラグア,(ⅱ)(ⅳ),,,,,ディエゴ・ホセ・デ・ポレス・エスキベル,,,,,,,"バロック様式
新古典主義様式",,,,
アメリカ,新大陸のキリスト教とミッション,ケレタロ州シエラ・ゴルダのフランシスコ会ミッション,メキシコ,(ⅱ)(ⅲ),,,,,,,,,"サンティアゴ・デ・ハルパン
タンコヨル",,,,,,,
アメリカ,新大陸のキリスト教とミッション,ポポカテペトル山麓の16世紀初期の修道院群,メキシコ,(ⅱ)(ⅳ),,,,,,,,,アトリウム,,,,,,,屋外で宗教儀式を行う習慣があった先住民が新しい宗教を受容しやすくするつくり
アメリカ,新大陸のキリスト教とミッション,サン・アントニオ・ミッションズ,アメリカ,(ⅱ),,,,コアウイルテカン族,,,,,,,,,,,,ヌエバ・エスパーニャの北の境界線を防衛する役割もあった
アメリカ,自由と独立,サン・ミゲルの要塞都市とアトトニルコにあるナザレのイエスの聖地,メキシコ,(ⅱ)(ⅳ),,,,,,,,,内陸部の王の道,,,メキシコ・バロック様式,,,,サン・ミゲル・デ・アジェンデは16世紀につくられた要塞都市
アメリカ,自由と独立,グアダラハラの救貧施設,メキシコ,(ⅰ)(ⅱ)(ⅲ)(ⅳ),,,,,,ホセ・クレメンテ・オロコス,,,オスピシオ・カバーニャス,,,,,,,
アメリカ,自由と独立,ハイチの国立歴史公園：シタデル、サン・スーシ宮、ラミエ地区,ハイチ,(ⅳ)(ⅵ),,,,,アンリ・クリストフ,,,,,,,,,,,ジャン・ジャック・デサリーヌを倒した
アメリカ,自由と独立,独立記念館,アメリカ,(ⅵ),,,,,トマス・ジェファソン,アンドリュー・ハミルトン,,,アセンブリールーム,,,,,,,第2回大陸会議で、トマス・ジェファンソンが起草した独立宣言が採択された
アメリカ,自由と独立,自由の女神像,アメリカ,(ⅰ)(ⅵ),,,,,エドゥアール・ドゥ・ラブライエ,フレデリック・バルトルディ,,,,,,,,,,世界を照らす自由と名付けられた
アメリカ,自由と独立,シャーロットビヴィルのモンティチェロとヴァージニア大学,アメリカ,(ⅰ)(ⅳ)(ⅵ),,,,,トマス・ジェファソン,,,,ロタンダ,,,,,,,
アメリカ,自由と独立,メキシコ国立大学（UNAM）の中央大学都市キャンパス,メキシコ,(ⅰ)(ⅱ)(ⅳ),,,,,,フアン・オゴルマン,,,,,,,メキシコ壁画運動,,,
アメリカ,自由と独立,ESMA　博物館と記憶の場：拘禁と拷問、虐殺のかつての機密拠点,アルゼンチン,(ⅵ),,負の遺産,,,,,,,,,,,,,,"汚い戦争
アルゼンチン海軍によって5000人以上が拘禁された
コンドル作戦がアメリカやCIAの支援のもと共同展開された"
アメリカ,現代都市と近現代建築,ブラジリア,ブラジル,(ⅰ)(ⅳ),,,,,ジュセリーノ・クビチェック・デ・オリヴェイラ大統領,ルシオ・コスタ,,,ブラジリア大聖堂,,,,,,,パイロットプラントが採用され、十字架型の平面からなる
アメリカ,現代都市と近現代建築,パンプーリャの近代建造物群,ブラジル,(ⅰ)(ⅱ)(ⅳ),,文化的景観,,,,"オスカー・ニーマイヤー
ジョアキム・カルドゾ",,,サン・フランシスコ・デ・アシス教会,,,,,,,
アメリカ,現代都市と近現代建築,カラカスの大学都市,ベネズエラ,(ⅰ)(ⅳ),,,,,,"カルロス・ラウル・ビリャヌエバ
アレキサンダー・カルダー",,,ベネズエラ中央大学,,,,,,,
アメリカ,現代都市と近現代建築,技術者エラディオ・ディエステの作品群：アトランティーダの教会,ウルグアイ,(ⅳ),,,,,,,,,,,,ガウス・ヴォールト,,,,"11～12世紀のイタリアにおける宗教建築から着想を得た
ウルグアイで入手が容易なレンガにモルタルと鉄筋を組み合わせた"
