宗教,クリスティアンスフェル：モラヴィア教会入植地,デンマーク/アメリカ/イギリス/ドイツ,(ⅲ)(ⅳ),,,,,,,シビック・バロック様式,"平等とヒューマニズムが重視された街のつくりはプロテスタントの理想都市を象徴
 ルター派"
宗教,タプタプアテア,フランス,(ⅲ)(ⅳ)(ⅵ),文化的景観,,,,,,,オロ神
宗教,聖都アブー・メナー,エジプト・アラブ,(ⅳ),危機遺産,,,聖者メナス,,,,コプト教
宗教,カイロの歴史地区,エジプト・アラブ,(ⅰ)(ⅴ)(ⅵ),,マムルーク朝,,,,ミスル・アル・カーヒラ,,1000のミナレットが立つ街
宗教,バンディアガラの断崖,マリ,(ⅴ)(ⅶ),,,ドゴン族,,,,,アンマ
宗教,サルト：寛容と都市的ホスピタリティの場,ヨルダン,(ⅱ)(ⅲ),,,,,,,,イスラム教徒とキリスト教が共同生活を送った
宗教,ハイファと西ガリラヤのバハイ教聖所群,イスラエル,(ⅲ)(ⅵ),,,,バハウッラー,,,,
宗教,テランガナ州にあるカカーティヤ時代のルドレシュワラ（ラマッパ）寺院,インド,(ⅰ)(ⅲ),,,,レチャーラ・ルドラ,,,,
宗教,アーグラ城,インド,(ⅲ),,ムガル帝国,,アクバル,,,,イスラム教徒とヒンドゥー教徒の融和を図った
宗教,エローラーの石窟寺院群,インド,(ⅰ)(ⅲ)(ⅵ),,,,,,"カイラーサ寺院
 チャイティヤ窟",,仏教・ヒンドゥー教・ジャイナ教
宗教,聖地アヌラーダプラ,スリ Lanka,(ⅱ)(ⅲ)(ⅵ),,,,マヒンダ,,,,
宗教,ラサのポタラ宮歴史地区,中国,(ⅰ)(ⅳ)(ⅵ),,,,ダライ・ラマ,,ジョカン寺,,
宗教,石窟庵と仏国寺,韓国,(ⅰ)(ⅳ),,,,金大城,,,,
学術関連,ザンクト・ガレンの修道院,スイス,(ⅱ)(ⅳ),,,,ガルス,,,,"ベネディクト会
 ロココ様式の付属図書館"
学術関連,パドヴァの植物園（オルト・ボタニコ）,イタリア,(ⅱ)(ⅲ),,,,アンドレア・モロニ,,,,世界最古の植物園
学術関連,キューの王立植物園,イギリス,(ⅱ)(ⅲ)(ⅳ),文化的景観,,,ジョージ3世の母,,パーム・ハウス,,
学術関連,プラド通りとブエン・レティーロ：芸術と科学の景観,スペイン,(ⅱ)(ⅳ)(ⅵ),文化的景観,,,,,,,知識の民主化という啓蒙思想と結びついている
学術関連,アルカラ・デ・エナレスの大学と歴史地区,スペイン,(ⅱ)(ⅳ)(ⅵ),,,,シスネスロ枢機卿,,,,
学術関連,サラマンカの旧市街,スペイン,(ⅰ)(ⅱ)(ⅳ),,,,,,,プラテレスコ様式,
学術関連,コインブラ大学：アルタとソフィア,ポルトガル,(ⅱ)(ⅳ)(ⅵ),,,,,,アルカソヴァの王宮,,
学術関連,シャーロットヴィルのモンティチェロとヴァージニア大学,アメリカ,(ⅰ)(ⅳ)(ⅵ),,,,トマス・ジェファンソン,,,,
学術関連,シンガポール植物園,シンガポール,(ⅱ)(ⅳ),文化的景観,イギリス植民地時代,,ローレンス・ニーベン,,,,ゴムのプランテーション
学術関連,メキシコ国立大学（UNAM）の中央大学都市キャンパス,メキシコ,(ⅰ)(ⅱ)(ⅳ),,,,,,,,メキシコ壁画運動
学術関連,モレリアの歴史地区,メキシコ,(ⅱ)(ⅳ)(ⅵ),,,,,,サン・ニコラス神学校,,
学術関連,カラカスの大学都市,ベネズエラ,(ⅰ)(ⅳ),,,,,,ベネズエラ大学,,
学術関連,ナーランダ・マハーヴィハーラの遺跡群,インド,(ⅳ)(ⅵ),,,,,,,,インド亜大陸における最古の大学
学術関連,ザビードの歴史地区,イエメン,(ⅱ)(ⅳ)(ⅵ),危機遺産,,,,,アル・アシャエル・モスク,,
天文学関連,書院：韓国の性理学教育機関群,韓国,(ⅲ),,李氏朝鮮時代,,,,,,
天文学関連,ジョドレルバンク天文台,イギリス,(ⅰ)(ⅱ)(ⅳ)(ⅵ),,,,バーナード・ラヴェル,,,,"ラヴェル望遠鏡
 国際天文学連合（IAU）"
天文学関連,海事都市グリニッジ,イギリス,(ⅰ)(ⅱ)(ⅳ)(ⅵ),,,,,,,バロック様式,経度0度の本初子午線が通る世界の基点
天文学関連,ブルーナ・ボーニャ：ボイン渓谷の考古遺跡,アイルランド,(ⅰ)(ⅲ)(ⅳ),,,,,,"ニューグレンジ
 ノウス
 ダウス",,
天文学関連,リスコ・カイドとグラン・カナリア島の聖なる山々の文化的景観,スペイン,(ⅲ)(ⅴ),文化的景観,,,,,アルモガレン,,
天文学関連,シュトルーベの測地弧,ウクライナ/エストニア/スウェーデン/ノルウェー/フィンランド/ベラルーシ/モルドバ/ラトビア/リトアニア/ロシア,(ⅱ)(ⅳ)(ⅵ),,,,フリードリヒ・フォン・シュトルーベ,,,,三角測量を行い地球がわずかに楕円形であることが証明された
天文学関連,ジャイプールのジャンタル・マンタル‐マハラジャの天文台,インド,(ⅲ)(ⅳ),,,,ジャイ・シング2世,,サムラート・ヤントラ,,
天文学関連,文化交差路サマルカンド,ウズベキスタン,(ⅰ)(ⅱ)(ⅳ),,,,ウルグ・ベク,,,,
天文学関連,アフラージュ‐オマーンの灌漑システム,オマーン,(ⅴ),,,,,,,,ファラジの複数形
天文学関連,バイカル湖,ロシア,(ⅶ)(ⅷ)(ⅸ)(ⅹ),,,,,,,,ニュートリノ望遠鏡
天文学関連,フラーネカーのエイシンハ・プラネタリウム,オランダ,(ⅳ),,,,エイセ・エイシンハ,,,,
天文学関連,フレーデフォート・ドーム,南アフリカ,(ⅷ),,,,,,,,世界最古にして最大最新の隕石痕
天文学関連,チャンキーヨの天文考古学遺産群,ペルー,(ⅰ)(ⅳ),,,,,,,,太陽を観測して1年の日付を示す暦
天文学関連,開城歴史遺跡地区,北朝鮮,(ⅱ)(ⅲ),,高麗王朝,,,,,,
天文学関連,天壇：北京の皇帝祭壇,中国,(ⅰ)(ⅱ)(ⅲ),,,,,,"祈念殿
 皇穹宇
 圜丘壇",,
産業・経済活動関連遺産,登封の歴史的建造物群‐天地之中,中国,(ⅲ)(ⅵ),,,,,,,,嵩山（中岳）
産業・経済活動関連遺産,ヴィエリチカとボフニャの王立岩塩坑,ポーランド,(ⅳ),,,,カジミエシュ2世,,"聖ギンガの礼拝堂
 ヴィエリチカの製塩所",,ポーランド王国の財源の3分の1を占める
産業・経済活動関連遺産,ラス・メドゥラス,スペイン,(ⅰ)(ⅱ)(ⅲ)(ⅳ),,古代ローマ時代,,,,,,"金の採掘城跡
 大量の水で山を削る技法が用いられた"
産業・経済活動関連遺産,フライ・ベントスの産業景観,ウルグアイ,(ⅱ)(ⅳ),,,,,,,,ウルグアイ川に突き出た食肉処理工場
産業・経済活動関連遺産,サワルントのオンピリン炭鉱遺産,インドネシア,(ⅱ)(ⅳ),文化的景観,,,,,,,石炭の採掘から製造輸送出荷までが一体となったシステム
産業・経済活動関連遺産,ペルシア湾の真珠産業関連遺：島嶼経済の証拠,バーレーン,(ⅲ),,,,,,カラット・ブ・マヒール要塞,,日本の真珠養殖による産業の衰退
産業・経済活動関連遺産,レッド・ベイのバスク人捕鯨基地,カナダ,(ⅲ)(ⅳ),,,,,,,,グラン・ベイヤ
産業・経済活動関連遺産,コルドゥアン灯台,フランス,(ⅰ)(ⅳ),,,,ルイ・ド・フォワ技師,,,マニエリスム,フランス王の栄光の象徴
産業・経済活動関連遺産,ヴァールベリのグリメトン無線局,スウェーデン,(ⅱ)(ⅳ),,,,,,,,"初代アレクサンダーソン製の送信機
 現在は使用されていないがいつでも使用可能な状態である
 大西洋を越える無線通信が可能"
産業・経済活動関連遺産,ダーウェント峡谷の工場群,イギリス,(ⅱ)(ⅳ),,,,リチャード・アークライト,,,,クロムフォード村の工場
産業・経済活動関連遺産,ニュー・ラナーク,イギリス,(ⅱ)(ⅳ)(ⅵ),,,,ロバート・オーウェン,,,,リチャード・アークライトの水力紡績機を導入
産業・経済活動関連遺産,クレスピ・ダッダの企業都市,イタリア,(ⅳ)(ⅴ),,,,,,,,紡績・織物工場
産業・経済活動関連遺産,リューカン・ノトッデンの産業遺産,ノルウェー,(ⅱ)(ⅳ),,,,,,スウェルグフォス水力発電所,,ノシュク・ハイドロ社が空気から窒素を固定する合成肥料を製造するために設立
産業・経済活動関連遺産,セウェル鉱山都市,チリ,(ⅱ),,,,,,エル・テニエンテ銅山,,
産業・経済活動関連遺産,サラン・レ・バン大製塩所からアルケ・スナン王立製塩所までの天日塩生産所,フランス,(ⅰ)(ⅱ)(ⅳ),,,,クロード・ニコラ・ルドゥ,,,,円形に配置することで労働組織の効率化
産業・経済活動関連遺産,アウクスブルクの水管理システム,ドイツ,(ⅱ)(ⅳ),,,,,,"運河網
 ポンプ式の給水塔
 冷水ホール",,水力工学分野におけるパイオニアとなった
産業・経済活動関連遺産,Ir.D.F.ヴァウダヘマール：D.F.ヴァウダ技師による蒸気水揚げポンプ場,オランダ,(ⅰ)(ⅱ)(ⅳ),,,,,,,,世界最大の規模を誇る排水施設
産業・経済活動関連遺産,シューシュタルの歴史的水利システム,イラン・イスラム,(ⅰ)(ⅱ)(ⅴ),,,,,,,,ギャルギャル運河
産業・経済活動関連遺産,青城山と都江堰水利施設,中国,(ⅱ)(ⅳ)(ⅵ),,,,張陵,,,,
気候帯,ケベック旧市街の歴史地区,カナダ,(ⅳ)(ⅵ),,,,,,シャトー・フロントナック,,"ヌーヴェル・フランス
 ケベック法を制定しフランスの民法や言語の使用が認められている"
気候帯,オリンピック国立公園,アメリカ,(ⅶ)(ⅸ),,,,,,,,温帯雨林地帯
気候帯,メキシコ・シティの歴史地区とソチミルコ,メキシコ,(ⅱ)(ⅲ)(ⅳ)(ⅴ),,アステカ帝国,,,,,,テノチティトラン
気候帯,コロニア・デル・サクラメントの歴史地区,ウルグアイ,(ⅳ),,,,,,サグラード・サクラメント教会堂,,
気候帯,中央アマゾン自然保護区群,ブラジル,(ⅸ)(ⅹ),,,,,,,,"バルゼア
 イガポー"
気候帯,セラード自然保護地域群：ヴェアデイロス平原国立公園とエマス国立公園,ブラジル,(ⅸ)(ⅹ),,,,,オオアリクイ,,,
気候帯,キトの市街,エクアドル,(ⅱ)(ⅳ),,,キトス族,,,,,インカ第2の都市
気候帯,ボルドー、月の港,フランス,(ⅱ)(ⅳ),,,,,,,,海洋性気候
気候帯,コミの原生林,ロシア,(ⅶ)(ⅸ),,,,,,,,ツンドラ
気候帯,ダウリアの景観群,モンゴル及びロシア,(ⅸ)(ⅹ),,,,,"ゴビズキンカモメ
 サカツラガン
 マナヅル",,,
気候帯,西ガーツ山脈,インド,(ⅸ)(ⅹ),,,,,"シシオザル
 ニルギリタール",,,モンスーン気候帯
気候帯,ペルシアのカナート,イラン・イスラム,(ⅲ)(ⅳ),,,,,,,,地下灌漑水路システム
気候帯,ルウェンゾリ山地国立公園,ウガンダ,(ⅶ)(ⅹ),,,,,,,,マルゲリータ峰（スタンリー山）
気候帯,ナミブ砂漠,ナミビア,(ⅶ)(ⅷ)(ⅸ)(ⅹ),,,,,,,,"霧の影響を受け霧が貴重な広大な砂丘を含む海岸砂漠
 二層の構造となっており一方は酸化鉄の色によって砂漠は赤く見える"
気候帯,クジャター・グリーンランド：氷冠周縁部におけるノース人とイヌイット農業地域,デンマーク,(ⅴ),文化的景観,,"ノース人
 イヌイット",,,,,
地殻変動,タスマニア原生地帯,オーストラリア,(ⅲ)(ⅳ)(ⅵ)(ⅶ)(ⅷ)(ⅸ)(ⅹ),,,タスマニア・アボリジニ,,"タスマニアデビル
 カモノハシ",,,"クレイドル・マウンテン・セント・クレア・レイク国立公園
 ゴンドワナ大陸
 ステンシルと呼ばれる描画技法"
地殻変動,テ・ワヒポウナム,ニュージーランド,(ⅶ)(ⅷ)(ⅸ)(ⅹ),,,,,キウイ,アオラキ/マウント・クック,,"サザン・アルプス山脈
 氷河作用と地殻変動による景観"
地殻変動,ユングフラウ‐アレッチュのスイス・アルプス,スイス,(ⅶ)(ⅷ)(ⅸ),,,,,,,,アレッチュ氷河の周辺では浸食作用による氷河地形の典型を多く見ることができる
地殻変動,ピュイ山地とリマーニュ断層にある地殻変動地帯,フランス,(ⅷ),,,,,,,,ピュイ・ドゥ・ドーム
地殻変動,スイスのサルドナ上層地殻変動地帯,スイス,(ⅷ),,,,,,,,逆断層
地殻変動,シングヴェトリル国立公園,アイスランド,(ⅲ)(ⅳ),文化的景観,,,,,,,"ギャオ
 アルシング
 ゲイシール"
地殻変動,カナイマ国立公園,ベネズエラ,(ⅶ)(ⅷ)(ⅸ)(ⅹ),,先カンブリア時代,,,,,,"アウヤンテプイ山
 テーブルマウンテン
 アンヘルの滝"
地殻変動,グロス・モーン国立公園,カナダ,(ⅶ)(ⅷ),,,,,,,,地球内部のマントルが地表に露出したもの
地殻変動,大地溝帯にあるケニアの湖沼群,ケニア,(ⅶ)(ⅸ)(ⅹ),,,,,"コフラミンゴ
 ロスチャイルドキリン
 グレータークーズー",,,
地殻変動,マックォーリー島,オーストラリア,(ⅶ)(ⅷ),,,,,,,,マントルが噴出した玄武岩が海面から露出している
地殻変動,タジキスタン国立公園（パミールの山脈）,タジキスタン,(ⅶ)(ⅷ),,,,,,,,フェドチェンコ氷河
地殻変動,サガルマータ国立公園,ネパール,(ⅶ),,,,,,,,イエロー・バンド
カルスト地形,アンドレファナ乾燥林群,マダガスカル,(ⅶ)(ⅸ)(ⅹ),,,,,"クイナモドキ
 レムール",,,ツィンギー・ド・ベマラハ国立公園
カルスト地形,シュコツィアンの洞窟群,スロベニア,(ⅶ)(ⅷ),,,,,,,,ヴェリカ・ドヴォラナ
カルスト地形,アグテレク・カルストとスロバキア・カルストの洞窟群,スロバキア及びハンガリー,(ⅷ),,,,,,,,パラドゥラ・ドミツァ洞窟
カルスト地形,マンモス・ケーブ国立公園,アメリカ,(ⅶ)(ⅷ)(ⅹ),,,,,,,,世界最大級の鍾乳洞
カルスト地形,中国南部のカルスト地帯,中国,(ⅶ)(ⅷ),,,,,,,,湿潤熱帯および亜熱帯地域におけるカルスト地形
カルスト地形,プエルト・プリンセサ地下河川国立公園,フィリピン,(ⅶ)(ⅹ),,,,,パラワンヤマアラシ,,,
カルスト地形,フォン・ニャ‐ケ・バン国立公園,ベトナム,(ⅶ)(ⅸ)(ⅹ),,,,,,,,フォン・ニャ洞窟
カルスト地形,グヌン・ムル国立公園,マレーシア,(ⅶ)(ⅷ)(ⅸ)(ⅹ),,,,,,,,サワラク洞窟
カルスト地形,ヒエラポリスとパムッカレ,トルコ,(ⅲ)(ⅵ)(ⅶ),,アッタロス朝,,,,,,
カルスト地形,左江花山の岩絵の文化的景観,中国,(ⅲ)(ⅵ),文化的景観,,,,,,,祭礼の際に銅鼓を演奏する
火山,ポンペイ、エルコラーノ、ロッテ・アヌンツィアータの考古地区,イタリア,(ⅲ)(ⅳ)(ⅴ),,,,,,"外科医の家
 オプロンティスのヴィッラ",,ヴェスヴィオ山の噴火により火山灰に埋没した
火山,ガラホナイ国立公園,スペイン,(ⅶ)(ⅸ),,,,,ゲッケイジュ林,,,ガラホナイ山
火山,エトナ山,イタリア,(ⅷ),,,,,,,,"世界で最も活発に活動している成層火山
 2700年前から噴火の記録が残されている"
火山,レユニオン島：峻峰の圏谷、その外縁,フランス,(ⅶ)(ⅹ),,,,,,"ピトン・デ・ネージュ
 ピトン・ドゥ・ラ・フルネーズ
 レユニオン国立公園",,
火山,ピーコ島のブドウ栽培の景観,ポルトガル,(ⅲ)(ⅴ),,,,,,,,"2番目に大きな火山島
 直線状の石壁"
火山,テイデ国立公園,スペイン,(ⅶ)(ⅷ),,,,,,,,ラス・カニャダスの断崖
火山,ヴァトナヨークトル国立公園：火山と氷河がつくるダイナミックな自然,アイスランド,(ⅷ),,,,,,,,ヨークルフロイプ（氷河湖決壊洪水）
火山,アワッシュ川下流域,エチオピア,(ⅱ)(ⅲ)(ⅳ),,,,アウストラロピテクス・アファレンシス,,,,
火山,ギョレメ国立公園とカッパドキアの岩石群,トルコ,(ⅰ)(ⅲ)(ⅴ)(ⅶ),,,,,,,,"イコン破壊運動
 ギョレメ渓谷
 カイマクルとデリンクユの地下都市"
火山,タフテ・ソレイマーン,イラン・イスラム,(ⅰ)(ⅱ)(ⅲ)(ⅳ)(ⅵ),,,,,,,,"拝火壇（アザル・ゴシュナスブ）
 ソロモン王の玉座を意味するゾロアスター教の聖地跡"
火山,ウジュン・クロン国立公園,インドネシア,(ⅶ)(ⅹ),,,,,ジャワサイ,,,
火山,済州火山島と溶岩洞窟群,韓国,(ⅶ)(ⅷ),,,,,,,,"城山日出峰
 世界で最も長く複雑な火山洞窟"
火山,ハード島とマクドナルド諸島,オーストラリア,(ⅷ)(ⅸ),,,,,,,,マウソン山
火山,エル・ピナカーテとグラン・デシエルト・デ・アルタル生物圏保存地域,メキシコ,(ⅶ)(ⅷ)(ⅹ),,,,,,,,マール（爆裂火口）
火山,レビジャヘヒド群島,メキシコ,(ⅶ)(ⅸ)(ⅹ),,,,,,,,4つの島はそれぞれ海中に沈んだ火山の山頂にあたる
火山,モルヌ・トロワ・ピトン国立公園,ドミニカ,(ⅷ)(ⅹ),,,,,,,,ボイリング・レイク
火山,ホヤ・デ・セレンの考古遺跡,エルサルバドル,(ⅲ)(ⅳ),,,,,,,,ロマ・カルデラ火山
火山,ピトンズ管理地区,セントルシア,(ⅶ)(ⅷ),,,,,,,,ピトン・ミタン尾根
森林,カルパティア山脈と他のヨーロッパ地域のブナ原生林,アルバニア/イタリア/ウクライナ/オーストリア/北マケドニア/クロアチア/スイス/スペイン/スロバキア/スロベニア/チェコ/ドイツ/フランス/ブルガリア/ベルギー/ポーランド/ボスニア・ヘルツェゴビナ/ルーマニア,(ⅸ),,,,,"キンメフクロウ
 ヨーロッパブナ",,,"18カ国に及ぶシリアル・ノミネーション
 10種の原生ブナ"
森林,マデイラ島の照葉樹林,ポルトガル,(ⅸ)(ⅹ),,第三紀,,,,,,氷河期以前の太古の姿を残した森林地帯
森林,シホテ・アリニ山脈中央部,ロシア,(ⅹ),,,,,"アムールトラ
 シマフクロウ",,,
森林,コルキスの多雨林群と湿地群,ジョージア,(ⅸ)(ⅹ),,,,,コルキスチョウザメ,,,
森林,ポルト湾：ピアナのカランケ、ジロラッタ湾、スカンドラ保護区,フランス,(ⅶ)(ⅷ)(ⅹ),,,,,マキー（常緑低木林）,,,
森林,アルタイ・ゴールデン・マウンテン,ロシア,(ⅹ),,,,,ユキヒョウ,,,
森林,タラマンカ山脈地帯：ラ・アミスタ自然保護区群とラ・アミスタ国立公園,コスタリカ及びパナマ,(ⅶ)(ⅷ)(ⅸ)(ⅹ),,,,,,,,チリポ山
森林,ロス・アレルセス国立公園,アルゼンチン,(ⅶ)(ⅹ),,,,,アレルセ,,,
森林,ロス・カティオス国立公園,コロンビア,(ⅸ)(ⅹ),,,,,,,,中米と南米の境界
森林,リオ・プラタノ生物圏保存地域,ホンジュラス,(ⅶ)(ⅷ)(ⅸ)(ⅹ),,危機遺産,,,コンゴウインコ,,,プラタノ川
森林,リオ・アビセオ国立公園,ペルー,(ⅲ)(ⅶ)(ⅸ)(ⅹ),,,,,"ヘンディーウーリーモンキー
 プヤ",,,
森林,サウス・イースト大西洋沿岸森林保護区群,ブラジル,(ⅶ)(ⅸ)(ⅹ),,,,,,,,大西洋沿岸森林
森林,レッドウッド国立・州立公園群,アメリカ,(ⅶ)(ⅸ),,,,,セコイア,,,レッドウッド保護連盟
森林,グレート・スモーキー山脈国立公園,アメリカ,(ⅶ)(ⅷ)(ⅸ)(ⅹ),,,,,カナダカワウソ,,,
森林,ニンバ山厳正自然保護区群,ギニア及びコートジボワール,(ⅸ)(ⅹ),,危機遺産,,,,,,ハルマッタン（貿易風）
森林,ジャー動物保護区,カメルーン,(ⅸ)(ⅹ),,,,,ニシローランドゴリラ,,,
森林,カディーシャ渓谷（聖なる谷）と神の杉の森（ホルシュ・アルツ・エルラブ）,レバノン,(ⅲ)(ⅳ),,文化的景観,,,レバノン杉,,,
森林,湖北の神農架,中国,(ⅸ)(ⅹ),,,,,チュウゴクオオサンショウウオ,,,
森林,オーストラリアのゴンドワナ雨林,オーストラリア,(ⅷ)(ⅸ)(ⅹ),,,,,ナンキョクブナ,,,世界最大級の多雨林帯
森林,クイーンズランドの湿潤熱帯地域,オーストラリア,(ⅶ)(ⅷ)(ⅸ)(ⅹ),,,,,ニオイネズミカンガルー,,,
森林,スリランカ中央高地,スリランカ,(ⅸ)(ⅹ),,,,,ニシカオムラサキラングール,"ホートン・プレインズ国立公園
 ナックルズ森林保護区
 ピーク・ウィルダネス保護区",,
固有の生態系と絶滅危惧種,西カフカス山脈,ロシア,(ⅸ)(ⅹ),,,,,ヨーロッパバイソン,,,"人為的な影響を受けていない大規模な山岳地帯
 飼育された個体を自然の生息地に戻し定着させる"
固有の生態系と絶滅危惧種,キナバル自然公園,マレーシア,(ⅸ)(ⅹ),,,,,フタバガキ,,,キナバル山
固有の生態系と絶滅危惧種,サンガイ国立公園,エクアドル,(ⅶ)(ⅷ)(ⅸ)(ⅹ),,,,,メガネグマ,,,植物の垂直分布
固有の生態系と絶滅危惧種,マヌー国立公園,ペルー,(ⅸ)(ⅹ),,,,,,,,"ペルー最大の国立公園
 アマゾン川流域がギアナ高地とブラジル中央高原に挟まれた内海であった痕跡"
固有の生態系と絶滅危惧種,マナス野生動物保護区,インド,(ⅶ)(ⅸ)(ⅹ),,,,,"コビトイノシシ
 ゴールデンラングール
 スイギュウ",,,
固有の生態系と絶滅危惧種,イヴィンド国立公園,ガボン,(ⅸ)(ⅹ),,,,,マルミミゾウ,,,
固有の生態系と絶滅危惧種,雲南保護地域の三江併流群,中国,(ⅶ)(ⅷ)(ⅸ)(ⅹ),,,,,,"金沙江
 欄滄江
 怒江",,"横断山脈
 明永氷河"
固有の生態系と絶滅危惧種,シャーク湾,オーストラリア,(ⅶ)(ⅷ)(ⅸ)(ⅹ),,,,,"ストロマトライト
 ジュゴン",,,世界最大の海草藻場
固有の生態系と絶滅危惧種,カリフォルニア湾の島々と自然保護区群,メキシコ,(ⅶ)(ⅸ)(ⅹ),,,,,,,,"ソノラ砂漠
 大陸島と海洋島が同時に存在する"
固有の生態系と絶滅危惧種,ウランゲリ島保護区の自然生態系,ロシア,(ⅸ)(ⅹ),,,,,"タイヘイヨウセイウチ
 ホッキョクグマ",,,ホッキョクグマが世界一高い密度で生息
固有の生態系と絶滅危惧種,コイバ国立公園と特別海洋保護区,パナマ,(ⅸ)(ⅹ),,,,,,,,エルニーニョ現象の影響が及ばない湾内
固有の生態系と絶滅危惧種,アレハンドロ・デ・フンボルト国立公園,キューバ,(ⅸ)(ⅹ),,,,アレクサンダー・フォン・フンボルト,,,,
固有の生態系と絶滅危惧種,マルペロ動植物保護区,コロンビア,(ⅶ)(ⅸ),,,,,,,,マルペロ海底山脈
密猟,ガランバ国立公園,コンゴ民主,(ⅶ)(ⅹ),危機遺産,,,,"キタシロサイ
 コルドファンキリン",,,大型哺乳動物の生息に適した環境
密猟,セルー動物保護区,タンザニア,(ⅸ)(ⅹ),危機遺産,,,,,,,世界最大規模のアフリカゾウの生息地であった
密猟,ブウィンディ原生国立公園,ウガンダ,(ⅶ)(ⅹ),,,,,マウンテンゴリラ,,,
密猟,シミエン国立公園,エチオピア,(ⅶ)(ⅹ),,,,,"ゲラダヒヒ
 ワリアアイベックス",,,
密猟,ニョコロ・コバ国立公園,セネガル,(ⅹ),危機遺産,,,,,,,スーダン・サバンナ
密猟,コモエ国立公園,コートジボワール,(ⅸ)(ⅹ),,,,,,,,西アフリカ最大の国立公園
密猟,サロンガ国立公園,コンゴ民主,(ⅶ)(ⅸ),,,,,ボノボ,,,
密猟,W-アルリ-ペンジャーリ国立公園,ニジェール及びベナン及びブルキナファソ,(ⅸ)(ⅹ),危機遺産,,,,セーブルアンテロープ,,,スーダン・サヘル・サバナ
密猟,チトワン国立公園,ネパール,(ⅶ)(ⅸ)(ⅹ),,,,,,,,マラリア撲滅のために1950年代から大量の農薬が撒かれた
環境問題,カジランガ国立公園,インド,(ⅸ)(ⅹ),,,,,インドサイ,,,
環境問題,ヘンダーソン島,イギリス,(ⅶ)(ⅹ),,,,デ・キロス,,,,"プラスチックごみが大量に漂着することが問題となっている
 18世紀以降は無人島となったため自然が原始のまま保存された"
環境問題,チェスキー・クルムロフの歴史地区,チェコ,(ⅳ),,,,,,,,"ボヘミア
 聖ヴィート教会"
環境問題,イルリサット・アイスフィヨルド,デンマーク,(ⅶ)(ⅷ),,,,,,セルメク・クジャレク氷河,,地球温暖化の影響で近年グリーンランドの氷床は広範囲で溶け始めている
環境問題,隊商都市ウワダン、シンゲッティ、ティシット、ウワラタ,モーリタニア,(ⅲ)(ⅳ)(ⅴ),,,,,,,,"クサール（要塞化された村）
 砂漠化が進み都市の脅威となっている"
環境問題,エヴァーグレーズ国立公園,アメリカ,(ⅷ)(ⅸ)(ⅹ),,,,,,,,"ハンモック
 温帯と亜熱帯全米最大の湿原地域"
環境問題,ハ・ロン湾とカット・バ諸島,ベトナム,(ⅶ)(ⅷ),,,,,,,,"石灰岩台地
 石炭発掘による水質悪化環境汚染や生態系の破壊が問題となっている"
環境問題,グレート・ヒマラヤ国立公園保護地区,インド,(ⅹ),,,,,"ハイイロジュケイ
 ジャコウジカ",,,雪解け水を水源とする河川
