ヨーロッパ,文化交流,ニース：リヴィエラの冬のリゾート都市,フランス,(ⅱ),,,サルディーニャ王国,,,,,,,,,コスモポリタンな性格,,,,"地中海の海辺に位置する
"
ヨーロッパ,文化交流,慈善のための居住地群,"オランダ
ベルギー",(ⅱ)(ⅳ),,,ネーデルラント連合王国,,フレデリクスールト,,,,,,,,,,,"フレデリクスールトは最も早く設立された居住地である
博愛協会の本部が置かれた"
ヨーロッパ,文化交流,コルドバの歴史地区,スペイン,(ⅰ)(ⅱ)(ⅲ)(ⅳ),,,"共和制ローマ
西ゴート王国
後ウマイヤ朝",,,,,,メスキータ,二重アーチ,,リブ・ヴォールト,,"イスラム教
ユダヤ教
キリスト教",,
ヨーロッパ,文化交流,パドヴァの14世紀のフレスコ画群,イタリア,(ⅱ),,,,,,ジョット,,,スクロヴェーニ礼拝堂,,,,,,,遠近法や人間感情のリアルな描写といった、ルネサンスの萌芽が見られる
ヨーロッパ,文化交流,ボルガルの歴史的考古学的遺産群,ロシア,(ⅱ)(ⅵ),,,ヴォルガ・ボルガル文明,,,,,,,,,,,,,
ヨーロッパ,文化交流,シントラの文化的景観,ポルトガル,(ⅱ)(ⅳ)(ⅴ),,文化的景観,,,,,,,ペナ宮殿,19世紀のロマン主義を代表する建築,,"ゴシック様式
ルネサンス様式
イスラム様式",,,,
ヨーロッパ,通商と交易都市,ヴェネツィアとその潟,イタリア,(ⅰ)(ⅱ)(ⅲ)(ⅳ)(ⅴ)(ⅵ),,,,,,"カナレット
ティツィアーノ
ティントレット",,,サン・マルコ大聖堂/サン・マルコ広場/ドゥカーレ宮殿/リアルト橋/カ・ドーロ/サンタ・マリア・デッラ・サルーテ聖堂,聖マルコに捧げられた聖堂//ティントレットが描いた「天国」で有名,,,,,,"潟（ラグーナ）で都市を建設した人々の技術力と創造性の高さを示している
イストリア石という耐水性に優れた石灰質の石を積むことで、特有の基盤が形づくられた
アクア・アルタと呼ばれる高潮による被害が深刻化している
MoSEプロジェクトとは潟を一時的に海から隔離するための移動式水門を設置するプロジェクトである"
ヨーロッパ,通商と交易都市,ポルトの歴史地区、ルイス1世橋とセラ・ド・ピラール修道院,ポルトガル,(ⅳ),,,,,,ニコロ・ナッゾーニ,,,"ポルト大聖堂
サン・ベント駅
ボルサ宮
フェルナンド王の市壁",バロック様式の回廊を設計したのはニコロ・ナッゾーニ/世界で最も美しい駅と言われ,,,,,,
ヨーロッパ,通商と交易都市,ドゥブロブニクの旧市街,クロアチア,(ⅰ)(ⅲ)(ⅳ),,,,,,,,,ラザレット,,,,,,,"共和制の自治都市となって以降、独自の立場で共和国として自由を保持した
ユーゴスラビア内戦で深刻なダメージを受けた"
ヨーロッパ,通商と交易都市,ヘーゼビューとダーネヴィルケの国境の考古学的遺産群,ドイツ,(ⅲ)(ⅳ),,,,,,,,,,,,,,,,"ヨーロッパ大陸とスカンジナビア半島、北海とバルト海を結ぶ交易の拠点
デンマーク王国とフランク王国の国境だったダーネヴィルケの近くにある"
ヨーロッパ,通商と交易都市,コルフの旧市街,ギリシャ,(ⅳ),,,,,,,,,,,,,,,,"ヴェネツィア共和国の領土としてビザンツ帝国との交易路の安全確保に必要な島
4世紀もの間オスマン帝国からこの街を守った"
ヨーロッパ,通商と交易都市,ボルドー、月の港,フランス,(ⅱ)(ⅳ),,,,,,ヴィクトル・ルイ,,,大劇場（グラン・テアトル）,,,,,,,
ヨーロッパ,通商と交易都市,中世市場都市プロヴァン,フランス,(ⅱ)(ⅳ),,,,,,,,,サン・タユール教会,,,,,,,
ヨーロッパ,通商と交易都市,ベルギーとフランスの鐘楼群,"フランス
ベルギー",(ⅱ)(ⅳ),,,,,,,,,"アントウェルペンの聖母大聖堂
ダルケンクの市庁舎",,,,,,,フランドル地方、ワロン地方の都市に残された鐘楼
ヨーロッパ,旧市街と歴史地区（南ヨーロッパ）,歴史都市トレド,スペイン,(ⅰ)(ⅱ)(ⅲ)(ⅳ),,,カスティーリャ王国,,,,,,バブ・アル・マルドゥム・モスク/サンタ・マリア・ラ・ブランカ教会/トランスパレンテ/トランシトシナゴーグ,イスラム様式で建築されのちにロマネスク様式の装飾が施されたキリスト教会となった/ユダヤ教の礼拝所兼学校であるシナゴーグの内部にムデハル様式の装飾がある/スペイン・バロックの傑作/サミュエル・レビが建設を命じた,,,,"ユダヤ教
キリスト教
イスラム教",,レコンキスタの末カスティーリャ王国の王都となった
ヨーロッパ,旧市街と歴史地区（南ヨーロッパ）,ナポリの歴史地区,イタリア,(ⅱ)(ⅳ),,,ナポリ公国,,,,,,"スパッカ・ナポリ
カステル・デッヴォーロ",,,,,,,
ヨーロッパ,旧市街と歴史地区（南ヨーロッパ）,シエナの歴史地区,イタリア,(ⅰ)(ⅱ)(ⅳ),,,,,,,,,"ドゥオーモ
カンポ広場
マンジャの塔",,,,,,,
ヨーロッパ,旧市街と歴史地区（南ヨーロッパ）,セゴビアの旧市街とローマ水道橋,スペイン,(ⅰ)(ⅲ)(ⅳ),,,,,,,,,"アルカサル
カテドラル",,,,,,,
ヨーロッパ,旧市街と歴史地区（南ヨーロッパ）,アビラの旧市街と城壁外の教会群,スペイン,(ⅲ)(ⅳ),,,,,,,,,エル・シモロ,,,,,,,聖テレサが城壁外にサン・ホセ修道院を建立した
ヨーロッパ,旧市街と歴史地区（南ヨーロッパ）,エヴォラの歴史地区,ポルトガル,(ⅱ)(ⅳ),,,,,,,,,"ディアナ神殿
エスピリト・サント大学",,,,,,,
ヨーロッパ,旧市街と歴史地区（南ヨーロッパ）,ギマランイスの歴史地区とコウルス地区,ポルトガル,(ⅱ)(ⅲ)(ⅳ),,,,,アフォンソ1世,,,,ギマランイス城,,,,,,,
ヨーロッパ,旧市街と歴史地区（南ヨーロッパ）,サン・ジミニャーノ歴史地区,イタリア,(ⅰ)(ⅲ)(ⅳ),,,,,,,,,サンタ・マリア・アッスンタ参事会聖堂,,,,,,,皇帝派（ギベリン）と教皇派（ゲルフ）に分かれて内戦状態に陥った
ヨーロッパ,旧市街と歴史地区（南ヨーロッパ）,モデナ：大聖堂と市民の塔（トッレ・チヴィカ）、グランデ広場,イタリア,(ⅰ)(ⅱ)(ⅲ)(ⅳ),,,,,,ランフランコ,,,,,,,,,,白大理石づくりでギルランダがあるため「ギルランディーナ」と呼ばれる
ヨーロッパ,旧市街と歴史地区（南ヨーロッパ）,サン・マリノの歴史地区とティタノ山,サン・マリノ,(ⅲ),,,,,,,,,"バシリカ聖堂
プッブリコ宮殿",,,,,,,イタリア統一運動（リソルジメント）が興るもサン・マリノだけは独立を貫いた
ヨーロッパ,旧市街と歴史地区（西・北ヨーロッパ）,モスクワのクレムリンと赤の広場,ロシア,(ⅰ)(ⅱ)(ⅳ)(ⅵ),,,,,ユーリー・ドルゴルーキー,マトヴェイ・カザコフ,,,聖ワシリイ大聖堂/ウスペンスキー大聖堂/アルハンゲリスキー聖堂/イヴァン大帝の鐘楼/クレムリン大宮殿,赤の広場に立ち、城壁沿いにはレーニン廟がある/イヴァン4世のロシアで最初のツァーリとしての戴冠式が執り行われた///ニコライ1世の命によってコンスタンチン・トーンによって建国された,,,,,,"マトヴェイ・カザコフによってクレムリンの建築群は拡大した
ユーリー・ドルゴルーキーが木造の要塞を築いたことが起源だとされる"
ヨーロッパ,旧市街と歴史地区（西・北ヨーロッパ）,エディンバラの旧市街と新市街,イギリス,(ⅱ)(ⅳ),,,,,,ジェームズ・クレイグ,,,"エディンバラ城
シャーロット広場",スクーンの石が展示されている,,,,,,
ヨーロッパ,旧市街と歴史地区（西・北ヨーロッパ）,ベルンの旧市街,スイス,(ⅲ),,,,,ベルトルト・フォン・ツェーリンゲン,,,,時計塔/聖ヴィセンテ大聖堂/噴水/スイス連邦議事堂,ツィットグロックタームの名前で親しまれている/竣工までに150年を費やした後期ゴシック様式の大聖堂,,,,,,
ヨーロッパ,旧市街と歴史地区（西・北ヨーロッパ）,リヨンの歴史地区,フランス,(ⅱ)(ⅳ),フルヴィエールの丘,,,,,,,,,,,,絹織物工業,,,"フランス国内で最初にフランス語の本が出版された
「星の王子さま」の作者アントワーヌ・ドゥ・サン・テグジュペリがこの地で生まれた
絹織物工業に関する建造物が残っている
フルヴィエールの丘には1世紀初頭に建築された1万人の収容のローマ劇場が残る"
ヨーロッパ,旧市街と歴史地区（西・北ヨーロッパ）,ストラス・ブール：グラン・ディルからヌースタットのヨーロッパの都市景観,フランス,(ⅱ)(ⅳ),プティット・フランス,,,,,,,,,,,ハーフティンバー様式,,,,プティット・フランスと呼ばれる一角にはハーフティンバー様式のドイツ風木造家屋が立ち並ぶ
ヨーロッパ,旧市街と歴史地区（西・北ヨーロッパ）,クルディーガの旧市街,ラトビア,(ⅴ),,,クールラント・ゼムガレン公国,,,,,,,,,,,,,街の構造は、公国時代に発展した通りのレイアウトをほぼそのまま残している
ヨーロッパ,旧市街と歴史地区（西・北ヨーロッパ）,ビリニュスの歴史地区,リトアニア,(ⅱ)(ⅳ),,,リトアニア大公国,,ゲディミナス大公,ラウリーナス・グツェヴィチュス,,,,,,,,,,
ヨーロッパ,旧市街と歴史地区（西・北ヨーロッパ）,レーゲンスブルク旧市街とシュタットアムホーフ,ドイツ,(ⅱ)(ⅲ)(ⅳ),,,,,,,,,,,,,,,,"地域の人々がプロテスタントに改宗した歴史を伝える
神聖ローマ帝国議会が置かれた都市"
ヨーロッパ,旧市街と歴史地区（西・北ヨーロッパ）,バンベルクの旧市街,ドイツ,(ⅱ)(ⅳ),,,,,ハインリヒ2世,,,,,,,,,,,川の上に立つ旧市庁舎がある
ヨーロッパ,旧市街と歴史地区（西・北ヨーロッパ）,クヴェートリンブルクの旧市街と聖堂参事会教会、城,ドイツ,(ⅳ),,,東フランク王国,,ハインリヒ1世,,,,聖堂参事会教会,,,ハーフティンバー様式,,,,
ヨーロッパ,旧市街と歴史地区（西・北ヨーロッパ）,ラウマの旧市街,フィンランド,(ⅳ)(ⅴ),,,,,,,,,"フランチェスコ会修道院
聖十字架教会",,,,,,,スカンジナビア半島最大規模の木造平屋建築の家屋が残っている
ヨーロッパ,旧市街と歴史地区（西・北ヨーロッパ）,ルクセンブルク市の旧市街と要塞,ルクセンブルク,(ⅳ),,,,,,ヴォーバン,,,,,,イスパノ・モレスク様式,,,,カゼマッテという地下道要塞が一部残っている
ヨーロッパ,旧市街と歴史地区（中央・東ヨーロッパ）,ウィーンの歴史地区,オーストリア,(ⅱ)(ⅳ)(ⅵ),,危機遺産,ハプスブルク帝国,,フランツ・ヨーゼフ1世,,,,聖シュテファン大聖堂/ベルヴェデーレ宮殿/ホーフブルク王宮/ウィーン国立劇場/分離派会館,建設当初はロマネスク様式だったが13～14世紀の工事で主要部分がゴシック様式に改修された/サヴォイア公オイゲンによって建造された/ハプスブルク家の歴代の皇帝が暮らした宮殿,,"ユーゲントシュティール（アール・ヌーボー）
ウィーン分離派
初期近代建築運動",,,,リンクシュトラーセなどは建築の宝庫でもある
ヨーロッパ,旧市街と歴史地区（中央・東ヨーロッパ）,プラハの歴史地区,チェコ,(ⅱ)(ⅳ)(ⅵ),,,,,カール4世,,,,プラハ城/聖ヴィート大聖堂./国民劇場/旧市庁舎/カレル橋/ティーン聖母聖堂,,,,,,,"ヤン・フスが教皇を批判して火刑に処されたことでフス戦争が勃発
ハプスブルク家を国王に迎えた16世紀から徐々にカトリック化が進んだ
カレル大学の創設やカレル橋の再建などを手掛けた"
ヨーロッパ,旧市街と歴史地区（中央・東ヨーロッパ）,ブダペスト：ドナウ河岸とブダ城地区、アンドラーシ通り,ハンガリー,(ⅱ)(ⅳ),,,,マジャル人,マーチャーシュ1世,,,,くさり橋/マーチャーシュ聖堂/国会議事堂/リスト音楽院/アンドラーシ通り,結ばれたことで合併の機運が高まった,,,,,,ブダ城はマーチャーシュ1世の増改築で華やかなルネサンス様式の装飾が施された
ヨーロッパ,旧市街と歴史地区（中央・東ヨーロッパ）,サンクト・ペテルブルクの歴史地区と関連建造物群,ロシア,(ⅰ)(ⅱ)(ⅳ)(ⅵ),,,ロマノフ朝,,"ピョートル大帝
エカチェリーナ2世",アレクサンダー・ルブロン,,,"ペドロパブロフスク要塞
エルミタージュ美術館",,,,,,,
ヨーロッパ,旧市街と歴史地区（中央・東ヨーロッパ）,ザルツブルクの歴史地区,オーストリア,(ⅱ)(ⅳ)(ⅵ),,,,,,,,,"ホーエンザルツブルク城
ザンクト・ペーター修道院",,,,,,,ヴォルフガング・アマデウス・モーツァルトの生誕地
ヨーロッパ,旧市街と歴史地区（中央・東ヨーロッパ）,グラーツ：歴史地区とエッゲンベルク城,オーストリア,(ⅱ)(ⅳ),,,,,,,,,"聖エギディウス大聖堂
エッゲンベルク城",,,,,,,大阪城と城下を描いた大阪図屏風が再発見された
ヨーロッパ,旧市街と歴史地区（中央・東ヨーロッパ）,チェスキー・クルムロフの歴史地区,チェコ,(ⅳ),,,,,,,,,聖ヴィート教会,,,,,,,ボヘミアの小都市
ヨーロッパ,旧市街と歴史地区（中央・東ヨーロッパ）,シギショアラの歴史地区,ルーマニア,(ⅲ)(ⅴ),,,,トランシルヴァニア・ザクセン人,,,,,"靴職人の塔
仕立屋の塔",,,,,,,ヴラド3世は「吸血鬼ドラキュラ」のモデル
ヨーロッパ,旧市街と歴史地区（中央・東ヨーロッパ）,クラクフの歴史地区,ポーランド,(ⅳ),,,,,,,,,"ヴァヴェル城
ヤギェウォ大学",,,,,,,チャルトリスキ美術館は白貂を抱く貴婦人を所有している
ヨーロッパ,旧市街と歴史地区（中央・東ヨーロッパ）,オデーサの歴史地区,ウクライナ,(ⅱ)(ⅳ),,危機遺産,,,エカチェリーナ2世,,,,"プリモルスキー階段（オデーサ階段）
オデーサ・オペラ・バレエ劇場
パレ・ロワイヤル",,,,,,,
ヨーロッパ,旧市街と歴史地区（中央・東ヨーロッパ）,リヴィウ歴史地区,ウクライナ,(ⅱ)(ⅴ),,,,,,,,,リノック広場,バロック様式、ルネサンス様式の歴史的建造物をはじめ、美しい石畳でも知られる,,,,,,"1772年のポーランド分割によってオーストリア帝国領になった
セレドミスティアは14世紀に発展した都市"
ヨーロッパ,旧市街と歴史地区（中央・東ヨーロッパ）,ノウゴロドと周辺の歴史的建造物群,ロシア,(ⅱ)(ⅳ)(ⅵ),,,,,,,,,聖ソフィア聖堂,,,,,,,ヴェーチェを政治の最高機関とする自治共和国となると都市国家として最盛期を迎えた
ヨーロッパ,旧市街と歴史地区（中央・東ヨーロッパ）,クトナー・ホラ歴史地区の聖バルボラ教会とセドレツ地区の聖母マリア大聖堂,チェコ,(ⅱ)(ⅳ),,,,,,,,,"聖バルボラ教会
聖母マリア大聖堂",,,,,,,
ヨーロッパ,旧市街と歴史地区（中央・東ヨーロッパ）,ネセビルの古代都市,ブルガリア,(ⅲ)(ⅳ),,,,トラキア人,,,,,,,,,,,,街には「ローマ法大全」を編纂したユスティニアヌスによって建てられた旧府主教座聖堂が残っている
ヨーロッパ,旧市街と歴史地区（中央・東ヨーロッパ）,ポレチェ歴史地区にあるエウフラシウス聖堂の司教関連建造物群,クロアチア,(ⅱ)(ⅲ)(ⅳ),,,,,,,,,エウフラシウス聖堂,,,,,,,初期キリスト教建築とビザンツ建築の融合が見られる
ヨーロッパ,旧市街と歴史地区（中央・東ヨーロッパ）,コトルの文化歴史地域と自然,モンテネグロ,(ⅰ)(ⅱ)(ⅲ)(ⅳ),,,,,,,,,,,,,,,,"スラブ諸国で最初の航海士学校が設立された
1979年に世界で最初の危機遺産となった
都市国家ヴェネツィアの勢力下置かれると、オスマン帝国に対する前線基地となった"
ヨーロッパ,ルネサンス都市,フィレンツェの歴史地区,イタリア,(ⅰ)(ⅱ)(ⅲ)(ⅳ)(ⅵ),,,,,"コジモ・デ・メディチ
ロレンツォ・デ・メディチ",,,,サンタ・マリア・デル・フィオーレ大聖堂/ヴェッキオ宮殿/ピッティ宮殿/ヴェッキオ橋/ウフィツィ美術館,サンタ・レパラータ教会の跡地に建てられた広大なゴシック建築/入口にミケランジェロのダヴィデ像が立つ///春、ヴィーナスの誕生、受胎告知、聖家族が並ぶ,,,,,,ルネサンスの中心となった商業都市
ヨーロッパ,ルネサンス都市,ウルビーノの歴史地区,イタリア,(ⅱ)(ⅳ),,,,,モンテフェルトロ家,,,,"ドゥカーレ宮殿
ドゥーカの宮
天使の間",,,,,,,モンテフェルトロ家の当主フェデリーコが文芸を手厚く保護した
ヨーロッパ,ルネサンス都市,ルネサンス都市フェッラーラとポー川のデルタ地帯,イタリア,(ⅱ)(ⅲ)(ⅳ)(ⅴ)(ⅵ),,,,,,ビアージョ・ロセッティ,,,エステンセ城,,,,,,,
ヨーロッパ,ルネサンス都市,マントヴァとサッビオネータ,イタリア,(ⅱ)(ⅲ),,,,,ゴンザカ家,,,,ロトンダ,,,,,,,
ヨーロッパ,ルネサンス都市,ヴィチェンツァの市街とヴェネト地方のパッラーディオ様式の別荘群,イタリア,(ⅰ)(ⅱ),,,,,,アンドレア・パッラーディオ,,,,,,パッラーディオ様式,,,,
ヨーロッパ,ルネサンス都市,ピエンツァの歴史地区,イタリア,(ⅰ)(ⅱ)(ⅳ),,,,,ピウス2世,ベルナルド・ロッセリーノ,,,,,,,,,,
ヨーロッパ,ルネサンス都市,ウベダとバエーサのルネサンス様式の記念碑的建造物群,スペイン,(ⅱ)(ⅳ),,,,,,アンドレス・デ・ヴァンデルヴィラ,,,パラドール,,,,,,,
ヨーロッパ,ルネサンス都市,ザモシチの旧市街,ポーランド,(ⅳ),,,,,ヤン・ザモイスキ,,,,,,,マニエリスム様式,,,,
ヨーロッパ,独自の集落,ヘルシングランドの装飾された農夫の家,スウェーデン,(ⅴ),,,,,,,,,,,,グスタヴィアン様式,,,,"亜麻の栽培や森林開拓によって富を得た農夫たちが家屋を立て直した
祝祭用の部屋は特別な行事の時だけ使用される"
ヨーロッパ,独自の集落,要塞都市クエンカ,スペイン,(ⅱ)(ⅴ),,,,,アルフォンソ8世,,,,宙吊りの家,,,,,,,大モスク跡地に建てられたキリスト教の大聖堂はスペイン初のゴシック建築とされる
ヨーロッパ,独自の集落,アルベロベッロのトゥルッリ,イタリア,(ⅲ)(ⅳ)(ⅴ),,,,,ナポリ王フェルディナンド4世,,,,トゥルッリ,,,,,,,"建物の屋根には神話や宗教的なマークがホワイト・アッシュで描かれている
現役の住居建築として地域に根差しているが、石積み技術の継承など保存上の課題もある"
ヨーロッパ,独自の集落,マテーラの洞窟住居サッシと岩窟教会公園,イタリア,(ⅲ)(ⅳ)(ⅴ),,,,,,,,,"サンタ・マリア・デ・イドリス教会
サンタ・マリア・デッラ・コロンバ教会",,,,,,,ピタゴラス学派の影響もあり、高度な技術を用いた住居も建設される
ヨーロッパ,独自の集落,ルーレオにあるガンメルスタードの教会街,スウェーデン,(ⅱ)(ⅳ)(ⅴ),,,,,,,,,,,,,,,,"木造平屋コテージの宿泊施設が建てられた
47の村々からなる大規模な教区に発展した"
ヨーロッパ,独自の集落,ホローケーの伝統的集落,ハンガリー,(ⅴ),,,,,,,,,,,,パローツ様式,,,,トルコ系クマン人と関係があるともされる
ヨーロッパ,独自の集落,ヴルコリニェツの伝統的集落,スロバキア,(ⅳ)(ⅴ),,,,,,,,,聖母マリア受胎告知教会,,,,,,,"ヴルクがスロバキア語でオオカミを意味するよう
オオカミ狩りの猟師たちが住む村"
ヨーロッパ,独自の集落,ホラショヴィツェの歴史的集落,チェコ,(ⅱ)(ⅳ),,,,,,,,,"ヴィシー・ブロト修道院
ネポムクの聖ヨハネの小さな礼拝堂",,,南ボヘミアのバロック様式,,,,
ヨーロッパ,ひとつの時代を築いた遺産,アーヘンの大聖堂,ドイツ,(ⅰ)(ⅱ)(ⅳ)(ⅵ),,,フランク王国カロリング朝,,カール大帝,,,,,,,カロリング・ルネサンス,,,,八角形の中心部を十六角形の周歩廊が取り囲む集中式の構造
ヨーロッパ,ひとつの時代を築いた遺産,ヴィエリチカとボフニャの王立岩塩坑,ポーランド,(ⅳ),,,,,カジミエシュ2世,,,,聖ギンガの礼拝堂,,,,,,,塩の殺菌作用で空気が浄化されていることから、療養所なども設けられている
ヨーロッパ,ひとつの時代を築いた遺産,メディナ・アサーラのカリフ都市,スペイン,(ⅲ)(ⅳ),,,,,アブド・アッラフマーン3世,,,,,,,,,,,アル・アンダルスに対する深い知見を提供している
ヨーロッパ,ひとつの時代を築いた遺産,アストゥリアス王国とオビエドの宗教建築物群,スペイン,(ⅰ)(ⅱ)(ⅳ),,,,,ペラーヨ,,,,サンタ・マリア・デル・ナランコ教会,,,,,,,
ヨーロッパ,ひとつの時代を築いた遺産,イワノヴォの岩窟教会群,ブルガリア,(ⅱ)(ⅲ),,,,,,,,,,,,タルノヴォ派,,,,約300もの石窟の教会は13世紀半ば頃から建てられた
ヨーロッパ,ひとつの時代を築いた遺産,ボヤナの教会,ブルガリア,(ⅱ)(ⅲ),,,,,,,,,"聖パンティレイモン教会
聖二コラ教会",,,,,,,
ヨーロッパ,ひとつの時代を築いた遺産,ロルシェの修道院遺跡,ドイツ,(ⅲ)(ⅳ),,,,,,,,,王の門,,,,,,,聖ナザリウスの遺骨が納められたことで多くの巡礼者が集まった
ヨーロッパ,ひとつの時代を築いた遺産,コルヴァイの修道院に残るカロリング朝時代の西構えと修道院都市遺構,ドイツ,(ⅱ)(ⅲ)(ⅳ),,,カロリング朝,,,,,,"図書館
ヴェストヴェルク",,,,,,,
ヨーロッパ,ひとつの時代を築いた遺産,フランドル地方のベギン会の建物,ベルギー,(ⅱ)(ⅲ)(ⅳ),,,,,,,,,,,,,,ベギン会,,ルーヴェンにつくられたベギン会館はベルギーでも最大規模
ヨーロッパ,ひとつの時代を築いた遺産,スケリッグ・マイケル,アイルランド,(ⅲ)(ⅳ),,,,,,,,,,,,,,聖ミカエル,,ヨーロッパに現存する最古の修道院
ヨーロッパ,ひとつの時代を築いた遺産,イタリアのロンゴバルド族：権勢の足跡（568-774年）,イタリア,(ⅱ)(ⅲ)(ⅵ),,,ロンゴバルド王国,,,,,,,,,,"キリスト
ビザンツ
ゲルマン",,,
ヨーロッパ,ひとつの時代を築いた遺産,ベラトとギロカストラの歴史地区,アルバニア,(ⅲ)(ⅳ),,,,,,,,,,,,,,,,"タレットがついた家屋が特徴
ベラトは山の斜面に建てられ窓が多い"
ヨーロッパ,ひとつの時代を築いた遺産,マダラの騎馬像,ブルガリア,(ⅰ)(ⅲ),,,,,,,,,,,テルヴェル・ハーンを描いたもの,,,,,巨大な騎士のレリーフが高低差が100mある断崖に存在する
ヨーロッパ,ひとつの時代を築いた遺産,ビルカとホヴゴーデン,スウェーデン,(ⅲ)(ⅳ),,,,,,,,,,,,,,,,"ヴァイキングの大交易地の遺跡が残る場所
ルーン文字の石碑などが見つかる"
ヨーロッパ,都市計画,パリのセーヌ河岸,フランス,(ⅰ)(ⅱ)(ⅳ),,,,,"クローヴィス
ナポレオン1世
ジョルジュ・オスマン",,,,ノートル・ダム大聖堂/サント・シャペル/アンヴァリッド/グラン・パレ/ポン・ヌフ,19世紀半ばにヴィオレ・ル・デュクにより修復された/ルイ9世が収集した聖遺物を納めるために建設を命じた、ゴシック建築傑作の一つ///シテ島の先端にかかる石造りの12の半円状アーチからなる島,,,,,,万国博覧会の保存建築物が数多くある
ヨーロッパ,都市計画,ブリュッセルのグラン・プラス,ベルギー,(ⅱ)(ⅳ),,,,,,,,,"ギルドハウス
オテル・ド・ヴィル",,,,,,,"ルイ14世による砲撃で建物の大半は崩壊したが、ギルドの人々の団結によりわずか4年ほどで元通りとなった
「レ・ミゼラブル」の著者ヴィクトル・ユゴーは広場を世界一豪華と賞賛した"
ヨーロッパ,都市計画,ジェノヴァ：レ・ストラーデ・ヌオーヴェとパラッツィ・デイ・ロッリ制度,イタリア,(ⅱ)(ⅳ),,,,,,,,,"ストラーデ・ヌオーヴェ
パラッツォ",,,,,,,ロッリと呼ばれるリストに登録した
